symbol,name,marketCap
OXBR,Oxbridge Re Holdings Limited Ordinary Shares,6633364.00
GROMW,Grom Social Enterprises Inc. Warrants,6611905.00
DGLY,Digital Ally Inc. Common Stock,6581767.00
GPAK,Gamer Pakistan Inc. Common Stock,6558537.00
GV,Visionary Holdings Inc. Common Shares,6515500.00
AEI,Alset Inc. Common Stock (TX),6464583.00
KWE,KWESST Micro Systems Inc. Common Stock,6452685.00
WAVE,Eco Wave Power Global AB (publ) American Depositary Shares,6438000.00
BOXL,Boxlight Corporation Class A Common Stock,6412031.00
GXAI,Gaxos.ai Inc. Common Stock,6408918.00
RDZNW,Roadzen Inc. Warrants,6344465.00
PETWW,Wag! Group Co Warrant,6332254.00
NEOVW,NeoVolta Inc. Warrant,6318181.00
BSGM,BioSig Technologies Inc. Common Stock,6310214.00
BRTX,BioRestorative Therapies Inc. Common Stock (NV),6260200.00
PULM,Pulmatrix Inc. Common Stock,6245407.00
ALZN,Alzamend Neuro Inc. Common Stock,6241963.00
AZTR,Azitra Inc Common Stock,6233325.00
CRGOW,Freightos Limited Warrants,6226309.00
OPGN,OpGen Inc. Common Stock,6218398.00
XWEL,XWELL Inc. Common Stock,6185854.00
DRUG,Bright Minds Biosciences Inc. Common Stock,6160095.00
LQR,LQR House Inc. Common Stock,6133375.00
POLA,Polar Power Inc. Common Stock,6123066.00
ENSV,Enservco Corporation Common Stock,6088132.00
LCFY,Locafy Limited Ordinary Share,6062178.00
ECDA,ECD Automotive Design Inc. Common Stock,6028884.00
RVSN,Rail Vision Ltd. Ordinary Share,6026539.00
DCFC,Tritium DCFC Limited Ordinary Shares,6013028.00
BIOL,Biolase Inc. Common Stock,5984157.00
EZGO,EZGO Technologies Ltd. Ordinary Shares,5976685.00
PRZO,ParaZero Technologies Ltd. Ordinary Shares,5963782.00
HOTH,Hoth Therapeutics Inc. Common Stock,5954620.00
OCG,Oriental Culture Holding LTD Ordinary Shares,5943557.00
ENSC,Ensysce Biosciences Inc. Common Stock,5936629.00
NRSNW,NeuroSense Therapeutics Ltd. Warrant,5890982.00
AMST,Amesite Inc. Common Stock,5873036.00
SOBR,SOBR Safe Inc. Common Stock,5845248.00
SONN,Sonnet BioTherapeutics Holdings Inc. Common Stock,5832080.00
GTBP,GT Biopharma Inc. Common Stock,5798659.00
TGL,Treasure Global Inc. Common Stock,5796886.00
FORD,Forward Industries Inc. Common Stock,5772102.00
MOB,Mobilicom Limited American Depositary Shares,5765013.00
GBR,New Concept Energy Inc Common Stock,5747766.00
ESGL,ESGL Holdings Limited Ordinary Shares,5707368.00
SPEC,Spectaire Holdings Inc. Common Stock,5706388.00
NLSP,NLS Pharmaceutics Ltd. Ordinary Shares,5704437.00
SNGX,Soligenix Inc. Common Stock,5683196.00
NEXI,NexImmune Inc. Common Stock,5671550.00
BURU,Nuburu Inc. Common Stock,5626384.00
RCON,Recon Technology Ltd. Class A Ordinary Shares,5625317.00
ADTX,Aditxt Inc. Common Stock,5611771.00
TTNP,Titan Pharmaceuticals Inc. Common Stock,5611192.00
GDC,GD Culture Group Limited Common Stock,5607573.00
PGYWW,Pagaya Technologies Ltd. Warrants,5554839.00
SILO,Silo Pharma Inc. Common Stock,5545086.00
TMTCR,TMT Acquisition Corp Rights,5538500.00
ZVSA,ZyVersa Therapeutics Inc. Common Stock,5536655.00
MITQ,Moving iMage Technologies Inc. Common Stock,5526739.00
BON,Bon Natural Life Limited Ordinary Shares,5514795.00
TPET,Trio Petroleum Corp. Common Stock,5481406.00
THAR,Tharimmune Inc. Common Stock,5462471.00
MI,NFT Limited Class A Ordinary Share,5458734.00
KA,Kineta Inc. Common Stock,5409974.00
GRRRW,Gorilla Technology Group Inc. Warrant,5408030.00
MOBXW,Mobix Labs Inc Warrants,5393897.00
TPHS,Trinity Place Holdings Inc. Common Stock,5393804.00
SHCRW,Sharecare Inc. Warrant,5392085.00
CPOP,Pop Culture Group Co. Ltd Class A Ordinary Shares,5363152.00
XCUR,Exicure Inc. Common Stock,5298818.00
FAMI,Farmmi Inc. Ordinary Shares,5277472.00
AVGR,Avinger Inc. Common Stock,5259878.00
IFBD,Infobird Co. Ltd Ordinary Shares,5251718.00
STSS,Sharps Technology Inc. Common Stock,5249831.00
CJJD,China Jo-Jo Drugstores Inc. (Cayman Islands) Ordinary Shares,5216869.00
SSY,SunLink Health Systems Inc. Common Stock,5210046.00
EVOK,Evoke Pharma Inc. Common Stock,5195196.00
AFIB,Acutus Medical Inc. Common Stock,5183839.00
ICUCW,SeaStar Medical Holding Corporation Warrant,5125390.00
BTCT,BTC Digital Ltd. Ordinary Shares,5076559.00
MRIN,Marin Software Incorporated Common Stock,5058799.00
YOSH,Yoshiharu Global Co. Class A Common Stock,4981900.00
CNXA,Connexa Sports Technologies Inc. Common Stock,4964411.00
AMBO,Ambow Education Holding Ltd. American Depository Shares (each representing twenty (20) Class A Ordinary Shares),4941530.00
NTRBW,Nutriband Inc. Warrant,4935668.00
BTMWW,Bitcoin Depot Inc. Warrant,4931361.00
UAVS,AgEagle Aerial Systems Inc. Common Stock,4919083.00
VRPX,Virpax Pharmaceuticals Inc. Common Stock,4884042.00
PALI,Palisade Bio Inc. Common Stock,4883636.00
IMTE,Integrated Media Technology Limited Ordinary Shares,4882175.00
NVFY,Nova Lifestyle Inc. Common Stock,4855139.00
CAMP,CalAmp Corp. Common Stock,4853478.00
ARTL,Artelo Biosciences Inc. Common Stock,4841550.00
ZEOWW,Zeo Energy Corporation Warrants,4830836.00
BAOS,Baosheng Media Group Holdings Limited Ordinary shares,4788000.00
RHE,Regional Health Properties Inc. Common Stock,4782891.00
KXIN,Kaixin Auto Holdings Ordinary Shares,4781213.00
SOPA,Society Pass Incorporated Common Stock,4771213.00
CSSE,Chicken Soup for the Soul Entertainment Inc. Class A Common Stock,4761497.00
HPCO,Hempacco Co. Inc. Common Stock,4715013.00
VS,Versus Systems Inc. Common Shares,4702036.00
CCGWW,Cheche Group Inc. Warrant,4698852.00
SLNH,Soluna Holdings Inc. Common Stock,4684483.00
FUV,Arcimoto Inc. Common Stock,4678252.00
EJH,E-Home Household Service Holdings Limited Ordinary Shares,4655737.00
MYMD,MyMD Pharmaceuticals Inc. Common Stock (DE),4643436.00
AEMD,Aethlon Medical Inc. Common Stock,4611902.00
BREA,Brera Holdings PLC Class B Ordinary Shares,4600400.00
DTSTW,Data Storage Corporation Warrant,4595950.00
SLNHP,Soluna Holdings Inc 9.0% Series A Cumulative Perpetual Preferred Stock ,4579847.00
WORX,SCWorx Corp. Common Stock,4577712.00
CXAIW,CXApp Inc. Warrant,4576317.00
MNTS,Momentus Inc. Class A Common Stock,4560733.00
MGOL,MGO Global Inc. Common Stock,4541399.00
MDGS,Medigus Ltd. American Depositary Shares,4521270.00
BNRG,Brenmiller Energy Ltd Ordinary Shares,4497147.00
VIEW,View Inc. Class A Common Stock,4473739.00
GGE,Green Giant Inc. Common Stock,4461331.00
CEAD,CEA Industries Inc. Common Stock,4442005.00
CETX,Cemtrex Inc. Common Stock,4377697.00
LIPO,Lipella Pharmaceuticals Inc. Common Stock,4375024.00
BTTR,Better Choice Company Inc. Common Stock,4373263.00
CDTTW,Conduit Pharmaceuticals Inc. Warrant,4368827.00
RETO,ReTo Eco-Solutions Inc. Common Shares,4344419.00
VERB,Verb Technology Company Inc. Common Stock,4343274.00
SCPX,Scorpius Holdings Inc. Common Stock,4261781.00
CPHI,China Pharma Holdings Inc. Common Stock,4255359.00
SISI,Shineco Inc. Common Stock,4232515.00
REVB,Revelation Biosciences Inc. Common Stock,4229302.00
GNPX,Genprex Inc. Common Stock,4219874.00
GRDIW,GRIID Infrastructure Inc. Warrant,4219128.00
GOVX,GeoVax Labs Inc. Common Stock,4170762.00
MNYWW,MoneyHero Limited Warrants,4096324.00
NXTP,NextPlay Technologies Inc. Common Stock,4092587.00
VVOS,Vivos Therapeutics Inc. Common Stock,4052718.00
BNAIW,Brand Engagement Network Inc. Warrant,4045799.00
BFRGW,Bullfrog AI Holdings Inc. Warrants,4022465.00
HSDT,Helius Medical Technologies Inc. Class A Common Stock (DE),4008678.00
RSLS,ReShape Lifesciences Inc. Common Stock,3959550.00
FNCH,Finch Therapeutics Group Inc. Common Stock,3950177.00
NITO,N2OFF Inc. Common Stock,3930802.00
PXMD,PaxMedica Inc. Common Stock,3926276.00
KTRA,Kintara Therapeutics Inc. Common Stock,3919405.00
ATXG,Addentax Group Corp. Common Stock,3865481.00
TRNR,Interactive Strength Inc. Common Stock,3863129.00
LUCY,Innovative Eyewear Inc. Common Stock,3854196.00
CZOO,Cazoo Group Ltd Class A Ordinary Shares,3844372.00
NTRP,NextTrip Inc. Common Stock,3844045.00
LCFYW,Locafy Limited Warrant,3815982.00
MICS,The Singing Machine Company Inc. Common Stock,3798233.00
OGEN,Oragenics Inc. Common Stock,3776996.00
JAGX,Jaguar Health Inc. Common Stock,3755914.00
SNPX,Synaptogenix Inc. Common Stock,3749874.00
UUU,Universal Security Instruments Inc. Common Stock,3746877.00
SGN,Signing Day Sports Inc. Common Stock,3709595.00
JTAIZ,Jet.AI Inc. Merger Consideration Warrants,3696320.00
SBET,SharpLink Gaming Inc. Common Stock,3694217.00
JCSE,JE Cleantech Holdings Limited Ordinary Shares,3656369.00
CMND,Clearmind Medicine Inc. Common Shares,3641021.00
GOEVW,Canoo Inc. Warrant,3627097.00
ALBT,Avalon GloboCare Corp. Common Stock,3618847.00
ADD,Color Star Technology Co. Ltd. Class A Ordinary Shares,3581452.00
MGRX,Mangoceuticals Inc. Common Stock,3578295.00
SNES,SenesTech Inc. Common Stock,3544651.00
VTAK,Catheter Precision Inc. Common Stock,3512636.00
VERO,Venus Concept Inc. Common Stock,3483364.00
OMQS,OMNIQ Corp. Common Stock,3468651.00
OCTO,Eightco Holdings Inc. Common Stock,3464235.00
CTCXW,Carmell Corporation Warrant,3462246.00
REBN,Reborn Coffee Inc. Common Stock,3455434.00
CLEU,China Liberal Education Holdings Limited Ordinary Shares,3438818.00
BACK,IMAC Holdings Inc. Common Stock,3426346.00
MGAM,Mobile Global Esports Inc. Common Stock,3411846.00
FLJ,FLJ Group Limited American Depositary Shares,3407835.00
QH,Quhuo Limited American Depository Shares,3358270.00
ORGNW,Origin Materials Inc. Warrants,3356102.00
NXLIW,Nexalin Technology Inc. Warrant,3345709.00
NXGLW,NexGel Inc Warrant,3339095.00
DBGI,Digital Brands Group Inc. Common Stock,3337072.00
LDTCW,LeddarTech Holdings Inc. Warrants,3308663.00
EGOX,Next.e.GO N.V. Ordinary Shares,3286029.00
QNRX,Quoin Pharmaceuticals Ltd. American Depositary Shares,3261715.00
KWESW,KWESST Micro Systems Inc. Warrant,3260141.00
UCAR,U Power Limited Ordinary Shares,3249833.00
IONM,Assure Holdings Corp. Common Stock,3225821.00
NBY,NovaBay Pharmaceuticals Inc. Common Stock,3136227.00
PCSA,Processa Pharmaceuticals Inc. Common Stock,3128198.00
ZCMD,Zhongchao Inc. Class A Ordinary Shares,3111831.00
FOXO,FOXO Technologies Inc. Class A Common Stock,3108746.00
ACOR,Acorda Therapeutics Inc. Common Stock,3105245.00
AWIN,AERWINS Technologies Inc. Common Stock,3093308.00
NDRA,ENDRA Life Sciences Inc. Common Stock,3092810.00
TCBP,TC BioPharm (Holdings) plc American Depositary Shares,3081660.00
MDAIW,Spectral AI Inc. Warrants,3007163.00
JSPRW,Japer Therapeutics Inc. Warrants,2997715.00
WTO,UTime Limited Ordinary Shares,2991698.00
PRFX,PainReform Ltd. Ordinary Shares,2990040.00
FRGT,Freight Technologies Inc. Ordinary Shares,2980358.00
ASNS,Actelis Networks Inc. Common Stock,2970736.00
SGBX,Safe & Green Holdings Corp. Common Stock,2950416.00
COCHW,Envoy Medical Inc Warrant,2948137.00
AUVIP,Applied UV Inc. 10.5% Series A Cumulative Perpetual Preferred Stock $0.0001 par value per share,2901180.00
TC,TuanChe Limited American Depositary Shares,2899150.00
SNAX,Stryve Foods Inc. Class A Common Stock,2891706.00
ONCO,Onconetix Inc. Common Stock,2891589.00
LYT,Lytus Technologies Holdings PTV. Ltd. Common Shares,2889104.00
CSLRW,Complete Solaria Inc. Warrants,2888513.00
AEHL,Antelope Enterprise Holdings Limited Class A Ordinary Shares,2878400.00
BPTH,Bio-Path Holdings Inc. Common Stock,2874697.00
JWEL,Jowell Global Ltd. Ordinary Shares,2836604.00
DATS,DatChat Inc. Common Stock,2797417.00
CYCC,Cyclacel Pharmaceuticals Inc. Common Stock,2794705.00
YCBD,cbdMD Inc. Common Stock,2777124.00
CNEY,CN Energy Group Inc. Class A Ordinary Shares,2768368.00
DRMA,Dermata Therapeutics Inc. Common Stock,2760918.00
FWBI,First Wave BioPharma Inc. Common Stock,2753996.00
NCPL,Netcapital Inc. Common Stock,2741525.00
ITP,IT Tech Packaging Inc. Common Stock,2691627.00
LXEH,Lixiang Education Holding Co. Ltd. American Depositary Shares,2666013.00
YTEN,Yield10 Bioscience Inc. Common Stock,2635819.00
APLMW,Apollomics Inc. Warrant,2595196.00
HTOOW,Fusion Fuel Green PLC Warrant,2594081.00
NUWE,Nuwellis Inc. Common Stock,2591350.00
SHFSW,SHF Holdings Inc. Warrants,2567292.00
ESLAW,Estrella Immunopharma Inc. Warrant,2559100.00
THMO,ThermoGenesis Holdings Inc. Common Stock,2469056.00
SBFMW,Sunshine Biopharma Inc. Warrant,2439438.00
PTPI,Petros Pharmaceuticals Inc. Common Stock,2355144.00
TNON,Tenon Medical Inc. Common Stock,2352436.00
HSCSW,Heart Test Laboratories Inc. Warrant,2301213.00
INVO,INVO BioScience Inc. Common Stock,2276776.00
STAF,Staffing 360 Solutions Inc. Common Stock (DE),2274884.00
GWAV,Greenwave Technology Solutions Inc. Common Stock,2265009.00
MOTS,Motus GI Holdings Inc. Common Stock,2264119.00
SNOA,Sonoma Pharmaceuticals Inc. Common Stock,2263078.00
ONFO,Onfolio Holdings Inc. Common Stock,2243376.00
INM,InMed Pharmaceuticals Inc. Common Shares,2234416.00
DYNT,Dynatronics Corporation Common Stock,2228316.00
RCRT,Recruiter.com Group Inc. Common Stock,2222693.00
OBLG,Oblong Inc. Common Stock,2220716.00
RKDA,Arcadia Biosciences Inc. Common Stock,2220674.00
FREEW,Whole Earth Brands Inc. Warrant,2207220.00
ISPC,iSpecimen Inc. Common Stock,2199167.00
DCFCW,Tritium DCFC Limited Warrant,2144491.00
APVO,Aptevo Therapeutics Inc. Common Stock,2123187.00
TAOP,Taoping Inc. Ordinary Shares ,2120618.00
LSDI,Lucy Scientific Discovery Inc. Common Stock,2117556.00
SBFM,Sunshine Biopharma Inc. Common Stock,2103052.00
QLGN,Qualigen Therapeutics Inc. Common Stock,2072423.00
NCNC,noco-noco Inc. Ordinary Share,2012025.00
SYTA,Siyata Mobile Inc. Common Shares,1967919.00
PW,Power REIT (MD) Common Stock,1956173.00
SLRX,Salarius Pharmaceuticals Inc. Common Stock,1950987.00
ANGHW,Anghami Inc. Warrants,1937421.00
BPTS,Biophytis SA American Depositary Share (0.01 Euro),1935455.00
AENTW,Alliance Entertainment Holding Corporation Warrants,1935369.00
EIGR,Eiger BioPharmaceuticals Inc. Common Stock,1923336.00
FRES,Fresh2 Group Limited American Depositary Shares,1907287.00
WINT,Windtree Therapeutics Inc. Common Stock,1894545.00
BKYI,BIO-key International Inc. Common Stock,1882000.00
NAOV,NanoVibronix Inc. Common Stock,1878511.00
EDBL,Edible Garden AG Incorporated Common Stock,1837217.00
ATNF,180 Life Sciences Corp. Common Stock,1790821.00
NUZE,NuZee Inc. Common Stock,1771359.00
EFSH,1847 Holdings LLC Common Shares,1765685.00
XXII,22nd Century Group Inc. Common Stock,1752596.00
GNLN,Greenlane Holdings Inc. Class A Common Stock,1747611.00
TIVC,Tivic Health Systems Inc. Common Stock,1744649.00
WNW,Meiwu Technology Company Limited Ordinary Shares,1741295.00
RELI,Reliance Global Group Inc. Common Stock,1702484.00
TBLT,ToughBuilt Industries Inc. Common Stock,1681064.00
PETVW,PetVivo Holdings Inc. Warrant,1673648.00
DFLIW,Dragonfly Energy Holdings Corp. Warrant,1637647.00
PHIO,Phio Pharmaceuticals Corp. Common Stock,1637109.00
SXTP,60 Degrees Pharmaceuticals Inc. Common Stock,1633149.00
CNSP,CNS Pharmaceuticals Inc. Common Stock,1613944.00
DUO,Fangdd Network Group Ltd. American Depositary Shares,1611853.00
NBSE,NeuBase Therapeutics Inc.  Common Stock,1588642.00
SCNI,Scinai Immunotherapeutics Ltd. American Depositary Shares,1585872.00
BQ,Boqii Holding Limited American Depositary Shares representing Class A Ordinary Shares,1569117.00
GROM,Grom Social Enterprises Inc. Common Stock,1552617.00
EAST,Eastside Distilling Inc. Common Stock,1532276.00
AREB,American Rebel Holdings Inc. Common Stock,1505976.00
ALLR,Allarity Therapeutics Inc. Common Stock,1503942.00
NKGNW,NKGen Biotech Inc. Warrants,1503174.00
FGIWW,FGI Industries Ltd. Warrant,1500884.00
ADIL,Adial Pharmaceuticals Inc Common Stock,1498117.00
TANH,Tantech Holdings Ltd. Common Shares,1487400.00
KITTW,Nauticus Robotics Inc. Warrant,1466050.00
AUUD,Auddia Inc. Common Stock,1439680.00
NVNIW,Nvni Group Limited Warrants,1419797.00
LGMK,LogicMark Inc. Common Stock (NV),1410219.00
ASTI,Ascent Solar Technologies Inc. Common Stock,1407516.00
AMPGW,Amplitech Group Inc. Warrants,1357165.00
CDIOW,Cardio Diagnostics Holdings Inc. Warrant,1352066.00
TIRX,TIAN RUIXIANG Holdings Ltd Class A Ordinary Shares,1350544.00
MYSZ,My Size Inc. Common Stock,1341806.00
BSFC,Blue Star Foods Corp. Common Stock,1333767.00
WGSWW,GeneDx Holdings Corp. Warrant,1300072.00
WISA,WiSA Technologies Inc. Common Stock,1276694.00
ADNWW,Advent Technologies Holdings Inc. Warrant,1250625.00
STIXW,Semantix Inc. Warrant,1236001.00
PRSTW,Presto Automation Inc. Warrant,1228038.00
AWINW,AERWINS Technologies Inc. Warrant,1222420.00
STSSW,Sharps Technology Inc. Warrant,1221957.00
VRAX,Virax Biolabs Group Limited Ordinary Shares,1219431.00
XBPEW,XBP Europe Holdings Inc. Warrant,1203627.00
VINO,Gaucho Group Holdings Inc. Common Stock,1194334.00
NXU,Nxu Inc. Class A Common Stock,1194209.00
UK,Ucommune International Ltd Ordinary Shares,1193208.00
AERTW,Aeries Technology Inc. Warrant,1190168.00
MTEKW,Maris-Tech Ltd. Warrants,1181775.00
STRCW,Palladyne AI Corp Warrants,1165500.00
TENX,Tenax Therapeutics Inc. Common Stock,1154344.00
CEROW,CERo Therapeutics Holdings Inc. Warrants,1124582.00
SWAGW,Stran & Company Inc. Warrant,1114385.00
CURIW,CuriosityStream Inc. Warrant,1098110.00
BBLG,Bone Biologics Corp Common Stock,1068476.00
LUCYW,Innovative Eyewear Inc. Series A Warrants 8/16/27,1066964.00
BCAN,BYND Cannasoft Enterprises Inc. Common Stock,1055997.00
SAITW,SAI.TECH Global Corporation Warrant,1049293.00
BFIIW,BurgerFi International Inc. Warrant ,1046335.00
WLDSW,Wearable Devices Ltd. Warrant,1043836.00
PBMWW,Psyence Biomedical Ltd. Warrant,1040454.00
AULT,Ault Alliance Inc. Common Stock,1038078.00
SPCB,SuperCom Ltd. Ordinary Shares (Israel),1035814.00
HOVRW,New Horizon Aircraft Ltd. Warrant,1013379.00
CELUW,Celularity Inc. Warrant,1010725.00
COOTW,Australian Oilseeds Holdings Limited Warrant,1003281.00
CING,Cingulate Inc. Common Stock,1002590.00
SQFTW,Presidio Property Trust Inc. Series A Common Stock Purchase Warrants,982120.00
BRLSW,Borealis Foods Inc. Warrant,981670.00
SXTC,China SXT Pharmaceuticals Inc. Ordinary Shares,978374.00
PRSO,Peraso Inc. Common Stock,972971.00
BDRX,Biodexa Pharmaceuticals plc American Depositary Shs,945103.00
SPRC,SciSparc Ltd. Ordinary Shares,937962.00
BJDX,Bluejay Diagnostics Inc. Common Stock,936790.00
LGHL,Lion Group Holding Ltd. American Depositary Share,935917.00
SINT,SiNtx Technologies Inc. Common Stock,927618.00
COEPW,Coeptis Therapeutics Holdings Inc. Warrants,920293.00
NVVE,Nuvve Holding Corp. Common Stock,915050.00
AMPE,Ampio Pharmaceuticals Inc.,908286.00
GIPRW,Generation Income Properties Inc Warrant,890632.00
AGRI,AgriFORCE  Growing Systems Ltd. Common Shares,872338.00
NLSPW,NLS Pharmaceutics Ltd. Warrant,836665.00
NUKKW,Nukkleus Inc. Warrants,811743.00
BNZIW,Banzai International Inc. Warrant,745466.00
DAVEW,Dave Inc. Warrants,731889.00
AGBAW,AGBA Group Holding Limited Warrant,729670.00
CYTO,Altamira Therapeutics Ltd. Common Shares,716475.00
MMVWW,MultiMetaVerse Holdings Limited Warrant,660978.00
LIFWW,MSP Recovery Inc. Warrant,651312.00
DXF,Dunxin Financial Holdings Limited American Depositary Shares,646324.00
ONMDW,OneMedNet Corp Warrant,645267.00
GRYP,Gryphon Digital Mining Inc Common Stock,641825.00
BTBDW,BT Brands Inc. Warrant,624612.00
PEGY,Pineapple Energy Inc. Common Stock,622307.00
CRKN,Crown Electrokinetics Corp. Common Stock,619191.00
AGFY,Agrify Corporation Common Stock,603941.00
ZAPPW,Zapp Electric Vehicles Group Limited Warrant,598933.00
SXTPW,60 Degrees Pharmaceuticals Inc. Warrant,597352.00
EFTRW,eFFECTOR Therapeutics Inc. Warrant,589969.00
SVMHW,SRIVARU Holding Limited Warrant,588341.00
VWEWW,Vintage Wine Estates Inc. Warrants,567558.00
AUVI,Applied UV Inc. Common Stock,565197.00
GLMD,Galmed Pharmaceuticals Ltd. Ordinary Shares,543480.00
AGNCP,AGNC Investment Corp. Depositary Shares Each Representing a 1/1000th Interest in a Share of 6.125% Series F Fixed-to-Floating Rate Cumulative Redeemable Preferred Stock,535440.00
SECO,Secoo Holding Limited ADS,526361.00
MSAIW,MultiSensor AI Holdings Inc. Warrant,502187.00
VRMEW,VerifyMe Inc. Warrant,499590.00
VERBW,Verb Technology Company Inc. Warrant,498812.00
AKAN,Akanda Corp. Common Shares,495088.00
HUBCZ,Hub Cyber Security Ltd. Warrant 8/22/2025,490554.00
HOLOW,MicroCloud Hologram Inc. Warrant,472044.00
BROGW,Brooge Holdings Limited Warrant expiring 12/20/2024,471227.00
WKSPW,Worksport Ltd. Warrant,462522.00
GFAIW,Guardforce AI Co. Limited Warrant,453314.00
SMFL,Smart for Life Inc. Common Stock ,447726.00
RVSNW,Rail Vision Ltd. Warrant,442246.00
JFBR,Jeffs' Brands Ltd Ordinary Shares,442235.00
RNAZ,TransCode Therapeutics Inc. Common Stock,427977.00
SMX,SMX (Security Matters) Public Limited Company Class A Ordinary Shares,422541.00
HYMCW,Hycroft Mining Holding Corporation  Warrant,420104.00
HYMCL,Hycroft Mining Holding Corporation Warrants,418003.00
PAVMZ,PAVmed Inc. Series Z Warrant,411838.00
IVP,Inspire Veterinary Partners Inc. Class A Common Stock,399339.00
AGNCO,AGNC Investment Corp. Depositary Shares each representing a 1/1000th interest in a share of 6.50% Series E Fixed-to-Floating Cumulative Redeemable Preferred Stock,391874.00
FFIE,Faraday Future Intelligent Electric Inc. Common Stock,386904.00
AIMDW,Ainos Inc. Warrants,382863.00
GRI,GRI Bio Inc. Common Stock,357099.00
DHAIW,DIH Holding US Inc. Warrants,339769.00
FRBA,First Bank Common Stock,309722.00
SABSW,SAB Biotherapeutics Inc. Warrant,291531.00
AAGRW,African Agriculture Holdings Inc. Warrant,281750.00
OSAAW,ProSomnus Inc. Warrant,280044.00
ONFOW,Onfolio Holdings Inc. Warrant,255510.00
BFRIW,Biofrontera Inc. Warrants,254471.00
HGASW,Global Gas Corporation Warrant,248354.00
XOSWW,Xos Inc. Warrants,231248.00
CSSEL,Chicken Soup for the Soul Entertainment Inc. Warrant,225511.00
DATSW,DatChat Inc. Series A Warrant,189720.00
ACON,Aclarion Inc. Common Stock,184104.00
ECDAW,ECD Automotive Design Inc. Warrant ,166291.00
AGNCL,AGNC Investment Corp. Depositary Shares Each Representing a 1/1000th Interest in a Share of 7.75% Series G Fixed-Rate Reset Cumulative Redeemable Preferred Stock,165600.00
SPECW,Spectaire Holdings Inc. Warrant,158184.00
PTIXW,Protagenic Therapeutics Inc. Warrant,148577.00
LIXTW,Lixte Biotechnology Holdings Inc. Warrants,130459.00
VSSYW,Versus Systems Inc. Class A Warrants,127202.00
VLCN,Volcon Inc. Common stock,124748.00
HUBCW,Hub Cyber Security Ltd. Warrant 2/27/28,122638.00
SWVLW,Swvl Holdings Corp Warrant,118853.00
CREVW,Carbon Revolution Public Limited Company Warrant,112511.00
CPTNW,Cepton Inc. Warrant,109344.00
PRENW,Prenetics Global Limited Warrant,91338.00
ESGLW,ESGL Holdings Limited Warrants,88781.00
JFBRW,Jeffs' Brands Ltd Warrant,84167.00
CEADW,CEA Industries Inc. Warrant,80764.00
HOFVW,Hall of Fame Resort &amp; Entertainment Company Warrant,78678.00
KPLTW,Katapult Holdings Inc. Warrant,73580.00
AGRIW,AgriFORCE  Growing Systems Ltd. Warrant,71211.00
NCNCW,noco-noco Inc. Warrant,69237.00
MNTSW,Momentus Inc. Warrant,66319.00
CLVRW,Clever Leaves Holdings Inc. Warrant,66316.00
LFLYW,Leafly Holdings Inc. Warrant,65332.00
BTCTW,BTC Digital Ltd. Warrant,63457.00
TCBPW,TC BioPharm (Holdings) plc Warrants,62604.00
SONDW,Sonder Holdings Inc. Warrants,60856.00
GOVXW,GeoVax Labs Inc. Warrants,58217.00
SRZNW,Surrozen Inc. Warrant,57073.00
LIDRW,AEye Inc. Warrant,55275.00
ARTLW,Artelo Biosciences Inc. Warrant,51643.00
FFIEW,Faraday Future Intelligent Electric Inc. Warrant,47288.00
REVBW,Revelation Biosciences Inc. Warrant,42456.00
AREBW,American Rebel Holdings Inc. Warrants,42167.00
GSMGW,Cheer Holding Inc. Warrant expiring 2/13/2025,41287.00
SMXWW,SMX (Security Matters) Public Limited Company Warrant,35448.00
NVVEW,Nuvve Holding Corp. Warrant,31188.00
BRSH,Bruush Oral Care Inc. Common Stock,27103.00
VIEWW,View Inc. Warrant,26842.00
SYTAW,Siyata Mobile Inc. Warrant,26425.00
SHPWW,Shapeways Holdings Inc. Warrants,25537.00
AUUDW,Auddia Inc. Warrants,24540.00
SNAXW,Stryve Foods Inc. Warrant,23038.00
ACONW,Aclarion Inc. Warrant,22532.00
KTTAW,Pasithea Therapeutics Corp. Warrant,12815.00
CINGW,Cingulate Inc. Warrants,10401.00
ATNFW,180 Life Sciences Corp. Warrant,10233.00
LGHLW,Lion Group Holding Ltd. Warrant,6915.00
UKOMW,Ucommune International Ltd Warrant expiring 11/17/2025,3907.00
BRSHW,Bruush Oral Care Inc. Warrant,3835.00
QVCC,QVC Inc. 6.250% Senior Secured Notes due 2068,14.00
QVCD,QVC Inc. 6.375% Senior Secured Notes due 2067,14.00
CTBB,Qwest Corporation 6.5% Notes due 2056,10.00
CTDD,Qwest Corporation 6.75% Notes due 2057,10.00
AACI,Armada Acquisition Corp. I Common Stock,0.00
AACIU,Armada Acquisition Corp. I Unit,0.00
AACIW,Armada Acquisition Corp. I Warrant,0.00
AACT,Ares Acquisition Corporation II Class A Ordinary Shares,0.00
ABR^D,Arbor Realty Trust 6.375% Series D Cumulative Redeemable Preferred Stock Liquidation Preference $25.00 per Share,0
ABR^E,Arbor Realty Trust 6.25% Series E Cumulative Redeemable Preferred Stock,0
ABR^F,Arbor Realty Trust 6.25% Series F Fixed-to-Floating Rate Cumulative Redeemable Preferred Stock Liquidation Preference $25.00 per share,0
ACAB,Atlantic Coastal Acquisition Corp. II Class A Common Stock,0.00
ACAC,Acri Capital Acquisition Corporation Class A Common Stock,0.00
ACACU,Acri Capital Acquisition Corporation Unit,0.00
ACBAW,Ace Global Business Acquisition Limited Warrant,0.00
ACP,abrdn Income Credit Strategies Fund Common Shares,0.00
ACP^A,abrdn Income Credit Strategies Fund 5.250% Series A Perpetual Preferred Stock,0
ACR^C,ACRES Commercial Realty Corp. 8.625% Fixed-to-Floating Series C Cumulative Redeemable Preferred Stock ,0
ACR^D,ACRES Commercial Realty Corp. 7.875% Series D Cumulative Redeemable Preferred Stock,0
ADC^A,Agree Realty Corporation Depositary Shares each representing 1/1000th of a 4.250% Series A Cumulative Redeemable Preferred Stock,0
ADX,Adams Diversified Equity Fund Inc.,0.00
AEAE,AltEnergy Acquisition Corp. Class A Common Stock,0.00
AEFC,Aegon Funding Company LLC 5.10% Subordinated Notes due 2049,0.00
