symbol,name,marketCap
RLX,RLX Technology Inc. American Depositary Shares each representing the right to receive one (1) Class A ordinary share,2890254649.00
ARCH,Arch Resources Inc. Class A Common Stock,2886851446.00
CALM,Cal-Maine Foods Inc. Common Stock,2885565732.00
HESM,Hess Midstream LP Class A Share,2882423380.00
ADNT,Adient plc Ordinary Shares ,2878806851.00
DOOR,Masonite International Corporation Ordinary Shares (Canada),2877537702.00
CII,Blackrock Capital and Income Fund Inc.,2877066189.00
USAC,USA Compression Partners LP Common Units Representing Limited Partner Interests,2871693279.00
MGEE,MGE Energy Inc,2869955399.00
FBP,First BanCorp. New Common Stock,2859461698.00
SXT,Sensient Technologies Corporation Common Stock,2857775233.00
MYRG,MYR Group Inc. Common Stock,2853890247.00
FLYW,Flywire Corporation Voting Common Stock,2853328308.00
BRC,Brady Corporation Common Stock,2852530383.00
GBTG,Global Business Travel Group Inc. Class A Common Stock,2840445178.00
INDV,Indivior PLC Ordinary Shares,2834477534.00
GBDC,Golub Capital BDC Inc. Common Stock,2833430055.00
BNL,Broadstone Net Lease Inc. Common Stock,2826871140.00
CCS,Century Communities Inc. Common Stock,2826352004.00
RUM,Rumble Inc. Class A Common Stock,2825978971.00
ABM,ABM Industries Incorporated Common Stock,2822167272.00
QDEL,QuidelOrtho Corporation Common Stock,2817706004.00
UCBIO,United Community Banks Inc. Depositary Shares each representing 1/1000th interest in a share of Series I Non-CumulativePreferred Stock,2817453124.00
CENT,Central Garden & Pet Company Common Stock,2810662070.00
GNW,Genworth Financial Inc Common Stock,2806245442.00
FLNC,Fluence Energy Inc. Class A Common Stock,2804537425.00
IIPR,Innovative Industrial Properties Inc. Common Stock,2801644667.00
BANF,BancFirst Corporation Common Stock,2800582942.00
PAGS,PagSeguro Digital Ltd. Class A Common Shares,2798448600.00
ZD,Ziff Davis Inc. Common Stock,2798380237.00
TCBI,Texas Capital Bancshares Inc. Common Stock,2775817443.00
KLIC,Kulicke and Soffa Industries Inc. Common Stock,2773672698.00
KOS,Kosmos Energy Ltd. Common Shares (DE),2772434953.00
ATMU,Atmus Filtration Technologies Inc. Common Stock,2769198140.00
AIN,Albany International Corporation Common Stock,2768376000.00
GO,Grocery Outlet Holding Corp. Common Stock,2762494380.00
IFS,Intercorp Financial Services Inc. Common Shares,2758481381.00
CWEN,Clearway Energy Inc. Class C Common Stock,2753134568.00
APPN,Appian Corporation Class A Common Stock,2751806489.00
SKYW,SkyWest Inc. Common Stock,2751284152.00
ICFI,ICF International Inc. Common Stock,2750037349.00
AVA,Avista Corporation Common Stock,2739563940.00
NEP,NextEra Energy Partners LP Common Units representing limited partner interests,2727265952.00
YELP,Yelp Inc. Common Stock,2726466439.00
SG,Sweetgreen Inc. Class A Common Stock,2722812650.00
MOR,MorphoSys AG American Depositary Shares,2720207097.00
CERT,Certara Inc. Common Stock,2709548098.00
PAY,Paymentus Holdings Inc. Class A Common Stock,2705260913.00
FHB,First Hawaiian Inc. Common Stock,2703044614.00
SMMT,Summit Therapeutics Inc. Common Stock ,2701534139.00
CAAP,Corporacion America Airports SA Common Shares,2700503600.00
EVO,Evotec SE American Depositary Shares,2700297485.00
JJSF,J & J Snack Foods Corp. Common Stock,2699612687.00
DNLI,Denali Therapeutics Inc. Common Stock,2696925432.00
VCTR,Victory Capital Holdings Inc. Class A Common Stock,2696806149.00
RIOT,Riot Platforms Inc. Common Stock ,2690040440.00
GDRX,GoodRx Holdings Inc. Class A Common Stock,2685982130.00
OUT,OUTFRONT Media Inc. Common Stock,2685556952.00
PENN,PENN Entertainment Inc. Common Stock,2682636246.00
NARI,Inari Medical Inc. Common Stock,2676618430.00
LRN,Stride Inc. Common Stock,2673524110.00
CATY,Cathay General Bancorp Common Stock,2665525990.00
TROX,Tronox Holdings plc Ordinary Shares (UK),2662357960.00
BIPH,Brookfield Infrastructure Corporation 5.000% Subordinated Notes due 2081,2662354344.00
ESE,ESCO Technologies Inc. Common Stock,2659285775.00
FIBK,First Interstate BancSystem Inc. Common Stock (DE),2658678890.00
ARVN,Arvinas Inc. Common Stock,2657996549.00
CWT,California Water Service Group Common Stock,2654211738.00
NMFCZ,New Mountain Finance Corporation 8.250% Notes due 2028,2653192832.00
BE,Bloom Energy Corporation Class A Common Stock,2643434137.00
PLXS,Plexus Corp. Common Stock,2643265361.00
GRBK,Green Brick Partners Inc. Common Stock,2638898573.00
SIMO,Silicon Motion Technology Corporation American Depositary Shares,2638034393.00
INSW,International Seaways Inc. Common Stock ,2634438148.00
CDP,COPT Defense Properties Common Shares of Beneficial Interest,2632508643.00
HELE,Helen of Troy Limited Common Stock,2629203955.00
CORT,Corcept Therapeutics Incorporated Common Stock,2625200960.00
GLNG,Golar Lng Ltd,2624990400.00
PATK,Patrick Industries Inc. Common Stock,2623877732.00
IART,Integra LifeSciences Holdings Corporation Common Stock,2621927026.00
NHI,National Health Investors Inc. Common Stock,2618915708.00
MRUS,Merus N.V. Common Shares,2616098437.00
WSFS,WSFS Financial Corporation Common Stock,2614948135.00
TBBB,BBB Foods Inc. Class A Common Shares,2613155514.00
MP,MP Materials Corp. Common Stock,2612399536.00
OI,O-I Glass Inc. Common Stock,2607777592.00
BATRA,Atlanta Braves Holdings Inc. Series A Common Stock,2607359783.00
ARLP,Alliance Resource Partners L.P. Common Units representing Limited Partners Interests,2603500074.00
HIW,Highwoods Properties Inc. Common Stock,2600473749.00
AWR,American States Water Company Common Stock,2589583368.00
HUBG,Hub Group Inc. Class A Common Stock,2585969898.00
ZKH,ZKH Group Limited American Depositary Shares each representing thirty-five (35) Class A Ordinary Shares,2585885851.00
ALG,Alamo Group Inc. Common Stock,2585808624.00
GSAT,Globalstar Inc. Common Stock,2584000000.00
MPW,Medical Properties Trust Inc. common stock,2582121000.00
LU,Lufax Holding Ltd American Depositary Shares each representing two (2) Ordinary Shares,2581975000.00
PLTK,Playtika Holding Corp. Common Stock,2579715585.00
CSQ,Calamos Strategic Total Return Common Stock,2578746105.00
SPB,Spectrum Brands Holdings Inc. Common Stock,2575810869.00
RUN,Sunrun Inc. Common Stock,2573595527.00
ALPN,Alpine Immune Sciences Inc. Common Stock,2570063993.00
DJTWW,Trump Media & Technology Group Corp. Warrants,2566818212.00
LXP,LXP Industrial Trust Common Stock (Maryland REIT),2566205042.00
UTZ,Utz Brands Inc Class A Common Stock ,2565978726.00
PINC,Premier Inc. Class A Common Stock,2560508010.00
PTVE,Pactiv Evergreen Inc. Common stock,2558723042.00
SLVM,Sylvamo Corporation Common Stock,2556933047.00
MTRN,Materion Corporation,2554113815.00
NMIH,NMI Holdings Inc. Class A Common Stock,2553376644.00
DRVN,Driven Brands Holdings Inc. Common Stock,2549758396.00
AMK,AssetMark Financial Holdings Inc. Common Stock,2547400948.00
CRK,Comstock Resources Inc. Common Stock,2539276703.00
TGNA,TEGNA Inc,2534172146.00
IESC,IES Holdings Inc. Common Stock,2533749690.00
AUB,Atlantic Union Bankshares Corporation Common Stock,2532585546.00
FTAIN,FTAI Aviation Ltd. 8.25% Fixed - Rate Reset Series C Cumulative Perpetual Redeemable Preferred Shares,2531710331.00
GH,Guardant Health Inc. Common Stock,2530407532.00
GOGL,Golden Ocean Group Limited Common Stock,2525297906.00
FTAIP,FTAI Aviation Ltd. 8.25% Fixed to Floating Rate Series A Cumulative Perpetual Redeemable Preferred Shares,2525194347.00
FTAIO,FTAI Aviation Ltd. 8.00% Fixed-to-Floating Rate Series B Cumulative Perpetual Redeemable Preferred Shares,2519179593.00
AVDX,AvidXchange Holdings Inc. Common Stock,2517275117.00
GSHD,Goosehead Insurance Inc. Class A Common Stock,2517140919.00
DNUT,Krispy Kreme Inc. Common Stock,2515317000.00
LZ,LegalZoom.com Inc. Common Stock,2514547487.00
EVTC,Evertec Inc. Common Stock,2513310682.00
BLMN,Bloomin' Brands Inc. Common Stock,2501183063.00
OII,Oceaneering International Inc. Common Stock,2499157815.00
STRA,Strategic Education Inc. Common Stock,2498525754.00
HBM,Hudbay Minerals Inc. Ordinary Shares (Canada),2498159850.00
PSMT,PriceSmart Inc. Common Stock,2496190150.00
BEAM,Beam Therapeutics Inc. Common Stock,2494643163.00
FTDR,Frontdoor Inc. Common Stock,2493332788.00
MIR,Mirion Technologies Inc. Class A Common Stock,2491200551.00
PLAY,Dave & Buster's Entertainment Inc. Common Stock,2488108914.00
LGIH,LGI Homes Inc. Common Stock,2484562433.00
FULT,Fulton Financial Corporation Common Stock,2483743559.00
ICUI,ICU Medical Inc. Common Stock,2476544215.00
GVA,Granite Construction Incorporated Common Stock,2475640152.00
VCEL,Vericel Corporation Common Stock,2475353807.00
CBU,Community Bank System Inc. Common Stock,2473377407.00
ELP,Companhia Paranaense de Energia (COPEL) American Depositary Shares (each representing one Unit consisting one Common Share and four non-voting Class B Preferred Shares),2470659870.00
LEG,Leggett & Platt Incorporated Common Stock,2464645540.00
IDCC,InterDigital Inc. Common Stock,2461058902.00
RXO,RXO Inc. Common Stock,2454308852.00
CEIX,CONSOL Energy Inc. Common Stock ,2452054592.00
NYCB,New York Community Bancorp Inc. Common Stock,2449617857.00
VSTS,Vestis Corporation Common Stock,2448785661.00
FL,Foot Locker Inc.,2445382128.00
CMPR,Cimpress plc Ordinary Shares (Ireland),2444173590.00
ABR,Arbor Realty Trust Common Stock,2439258116.00
MWA,MUELLER WATER PRODUCTS Common Stock,2430119021.00
CARG,CarGurus Inc. Class A Common Stock ,2428124767.00
CENTA,Central Garden & Pet Company Class A Common Stock Nonvoting,2425828143.00
BATRK,Atlanta Braves Holdings Inc. Series C Common Stock,2421738536.00
SFB,Stifel Financial Corporation 5.20% Senior Notes due 2047,2419818358.00
WNS,WNS (Holdings) Limited Ordinary Shares,2416590025.00
WERN,Werner Enterprises Inc. Common Stock,2413714281.00
NTLA,Intellia Therapeutics Inc. Common Stock,2412270766.00
RYTM,Rhythm Pharmaceuticals Inc. Common Stock,2408626825.00
MTX,Minerals Technologies Inc. Common Stock,2400341607.00
TDOC,Teladoc Health Inc. Common Stock,2393668383.00
ROCK,Gibraltar Industries Inc. Common Stock,2387640882.00
NABL,N-able Inc. Common Stock,2387137934.00
JSM,Navient Corporation 6% Senior Notes due December 15 2043,2385787545.00
CNMD,CONMED Corporation Common Stock,2385493943.00
TGLS,Tecnoglass Inc. Ordinary Shares,2385082931.00
CABO,Cable One Inc. Common Stock,2384244140.00
BOH,Bank of Hawaii Corporation Common Stock,2379453138.00
SFNC,Simmons First National Corporation Class A Common Stock,2377466165.00
TMDX,TransMedics Group Inc. Common Stock,2375786248.00
PRCT,PROCEPT BioRobotics Corporation Common Stock,2372893664.00
PDCO,Patterson Companies Inc. Common Stock,2366124720.00
CVBF,CVB Financial Corporation Common Stock,2365178002.00
GTX,Garrett Motion Inc. Common Stock,2363504540.00
OSIS,OSI Systems Inc. Common Stock (DE),2356814110.00
MCW,Mister Car Wash Inc. Common Stock,2353423007.00
KTOS,Kratos Defense & Security Solutions Inc. Common Stock,2346453810.00
JBLU,JetBlue Airways Corporation Common Stock,2337618447.00
CPK,Chesapeake Utilities Corporation Common Stock,2336364623.00
INTA,Intapp Inc. Common Stock,2333284700.00
ASTH,Astrana Health Inc. Common Stock,2331108540.00
TIXT,TELUS International (Cda) Inc. Subordinate Voting Shares,2328061476.00
RCKT,Rocket Pharmaceuticals Inc. Common Stock,2325959174.00
EBC,Eastern Bankshares Inc. Common Stock,2325307768.00
SONO,Sonos Inc. Common Stock,2322056269.00
YY,JOYY Inc. American Depositary Shares,2318126812.00
MANU,Manchester United Ltd. Class A Ordinary Shares,2317961770.00
BBUC,Brookfield Business Corporation Class A Exchangeable Subordinate Voting Shares,2313003699.00
PAM,Pampa Energia S.A.,2303656771.00
KROS,Keros Therapeutics Inc. Common Stock,2303607845.00
CLDX,Celldex Therapeutics Inc.,2300871948.00
KYMR,Kymera Therapeutics Inc. Common Stock,2300243560.00
LAUR,Laureate Education Inc. Common Stock,2294506119.00
MBC,MasterBrand Inc. Common Stock,2293669268.00
PRGS,Progress Software Corporation Common Stock (DE),2290107951.00
CWK,Cushman & Wakefield plc Ordinary Shares,2289213402.00
HTZ,Hertz Global Holdings Inc Common Stock,2283615995.00
ZETA,Zeta Global Holdings Corp. Class A Common Stock,2282455361.00
ODD,ODDITY Tech Ltd. Class A Ordinary Shares,2282059668.00
DYN,Dyne Therapeutics Inc. Common Stock,2281712613.00
LFST,LifeStance Health Group Inc. Common Stock,2280332675.00
AESI,Atlas Energy Solutions Inc. Common Stock,2268580245.00
FA,First Advantage Corporation Common Stock,2267407900.00
FIHL,Fidelis Insurance Holdings Limited Common Shares,2262784129.00
BANC,Banc of California Inc. Common Stock,2261565335.00
DNA,Ginkgo Bioworks Holdings Inc. Class A Common Stock,2260015575.00
PJT,PJT Partners Inc. Class A Common Stock,2258997297.00
PRIM,Primoris Services Corporation Common Stock,2257708349.00
TGS,Transportadora de Gas del Sur SA TGS Common Stock,2255272136.00
TR,Tootsie Roll Industries Inc. Common Stock,2254526596.00
TNC,Tennant Company Common Stock,2254149064.00
CWH,Camping World Holdings Inc. Class A Common Stock,2252938713.00
PSEC,Prospect Capital Corporation Common Stock,2252092054.00
HEES,H&E Equipment Services Inc. Common Stock,2248778111.00
ALKT,Alkami Technology Inc. Common Stock,2245780591.00
AGYS,Agilysys Inc. Common Stock (DE),2244600497.00
NWTN,NWTN Inc. Class B Ordinary Shares,2243694485.00
CNK,Cinemark Holdings Inc Cinemark Holdings Inc. Common Stock,2240896936.00
RAMP,LiveRamp Holdings Inc. Common Stock,2238995620.00
JAMF,Jamf Holding Corp. Common Stock,2236019526.00
NPWR,NET Power Inc. Class A Common Stock,2235949087.00
KGS,Kodiak Gas Services Inc. Common Stock,2231664509.00
TGTX,TG Therapeutics Inc. Common Stock,2229835948.00
UPST,Upstart Holdings Inc. Common stock,2224714995.00
PARR,Par Pacific Holdings Inc.  Common Stock,2224547415.00
VERA,Vera Therapeutics Inc. Class A Common Stock,2224365385.00
CLBT,Cellebrite DI Ltd. Ordinary Shares,2223367214.00
SHO,Sunstone Hotel Investors Inc. Sunstone Hotel Investors Inc. Common Shares,2218508479.00
TALO,Talos Energy Inc. Common Stock,2214511054.00
TRN,Trinity Industries Inc. Common Stock,2213463520.00
WB,Weibo Corporation American Depositary Share,2210719559.00
XRX,Xerox Holdings Corporation Common Stock,2206724909.00
AMN,AMN Healthcare Services Inc,2205112970.00
PPBI,Pacific Premier Bancorp Inc,2202934475.00
PZZA,Papa John's International Inc. Common Stock,2201619635.00
DEI,Douglas Emmett Inc. Common Stock,2200677748.00
TNDM,Tandem Diabetes Care Inc. Common Stock,2198639874.00
EAT,Brinker International Inc. Common Stock,2196761249.00
NMRA,Neumora Therapeutics Inc. Common Stock,2187861611.00
FCPT,Four Corners Property Trust Inc. Common Stock,2185738711.00
CCU,Compania Cervecerias Unidas S.A. Common Stock,2180066945.00
PTCT,PTC Therapeutics Inc. Common Stock,2175668052.00
NTAP,NetApp Inc. Common Stock,2161176384.00
XPRO,Expro Group Holdings N.V. Common Stock,2160865277.00
VZIO,VIZIO Holding Corp. Class A Common Stock,2157606942.00
COUR,Coursera Inc. Common Stock,2156438672.00
ROG,Rogers Corporation Common Stock,2156341622.00
SNEX,StoneX Group Inc. Common Stock,2154549773.00
SIX,Six Flags Entertainment Corporation New Common Stock,2151983906.00
PLUG,Plug Power Inc. Common Stock,2148560961.00
AY,Atlantica Sustainable Infrastructure plc Ordinary Shares,2147019831.00
ARRY,Array Technologies Inc. Common Stock,2146778976.00
PRVA,Privia Health Group Inc. Common Stock,2146095751.00
SPNT,SiriusPoint Ltd. Common Shares,2142847226.00
RNA,Avidity Biosciences Inc. Common Stock,2142062240.00
MRVI,Maravai LifeSciences Holdings Inc. Class A Common Stock,2139412902.00
ARHS,Arhaus Inc. Class A Common Stock,2137948140.00
NYMTM,New York Mortgage Trust Inc. 7.875% Series E Fixed-to-Floating Rate Cumulative Redeemable Preferred Stock,2130144694.00
LSPD,Lightspeed Commerce Inc. Subordinate Voting Shares,2130011244.00
PAX,Patria Investments Limited Class A Common Shares,2126937405.00
DAVA,Endava plc American Depositary Shares (each representing one Class A Ordinary Share),2125236395.00
HWCPZ,Hancock Whitney Corporation 6.25% Subordinated Notes due 2060,2124148574.00
INDB,Independent Bank Corp. Common Stock,2123144918.00
JBI,Janus International Group Inc. Common Stock,2120830352.00
FUN,Cedar Fair L.P. Common Stock,2117723877.00
DQ,DAQO New Energy Corp. American Depositary Shares each representing five ordinary shares,2109961862.00
WLY,John Wiley & Sons Inc. Common Stock,2101803418.00
FOXF,Fox Factory Holding Corp. Common Stock,2100633676.00
CALX,Calix Inc Common Stock,2095055715.00
WLYB,John Wiley & Sons Inc. Common Stock,2091951214.00
GLPG,Galapagos NV American Depositary Shares,2091594184.00
AFGD,American Financial Group Inc. 5.625% Subordinated Debentures due 2060,2081502872.00
AGL,agilon health inc. Common Stock,2080471653.00
PRK,Park National Corporation Common Stock,2079992780.00
HPK,HighPeak Energy Inc. Common Stock,2079134743.00
AFGB,American Financial Group Inc. 5.875% Subordinated Debentures due 2059,2073973320.00
ERO,Ero Copper Corp. Common Shares,2072666215.00
AIR,AAR Corp. Common Stock,2068585800.00
HNI,HNI Corporation Common Stock,2067326751.00
WGO,Winnebago Industries Inc. Common Stock,2060511904.00
OMI,Owens & Minor Inc. Common Stock,2060451122.00
ENR,Energizer Holdings Inc. Common Stock,2059435191.00
RXRX,Recursion Pharmaceuticals Inc. Class A Common Stock,2057909195.00
SXI,Standex International Corporation Common Stock,2054211137.00
SBCF,Seacoast Banking Corporation of Florida Common Stock,2053467135.00
PLUS,ePlus inc. Common Stock,2052885641.00
FFBC,First Financial Bancorp. Common Stock,2052654677.00
SITM,SiTime Corporation Common Stock,2046606361.00
AGM,Federal Agricultural Mortgage Corporation Common Stock,2042283343.00
EQX,Equinox Gold Corp. Common Shares,2041945632.00
TNK,Teekay Tankers Ltd.,2040813445.00
THS,Treehouse Foods Inc. Common Stock,2040111000.00
GDV,Gabelli Dividend & Income Trust Common Shares of Beneficial Interest,2040063666.00
UCTT,Ultra Clean Holdings Inc. Common Stock,2038864792.00
CRGY,Crescent Energy Company Class A Common Stock,2035512949.00
AMPH,Amphastar Pharmaceuticals Inc. Common Stock,2035416880.00
VSAT,ViaSat Inc. Common Stock,2030192084.00
PLMR,Palomar Holdings Inc. Common stock,2029053551.00
NYMTN,New York Mortgage Trust Inc. 8.00% Series D Fixed-to-Floating Rate Cumulative Redeemable Preferred Stock,2024495064.00
DK,Delek US Holdings Inc. Common Stock,2023649030.00
ATGE,Adtalem Global Education Inc. Common Stock,2019361196.00
VET,Vermilion Energy Inc. Common (Canada),2018040000.00
HLMN,Hillman Solutions Corp. Common Stock,2016229574.00
TOWN,TowneBank Common Stock,2013921737.00
AMBP,Ardagh Metal Packaging S.A. Ordinary Shares,2013878300.00
EQC,Equity Commonwealth Common Shares of Beneficial Interest,2013576680.00
BKU,BankUnited Inc. Common Stock,2012482778.00
PD,PagerDuty Inc. Common Stock,2005289376.00
VIAV,Viavi Solutions Inc. Common Stock,1998640651.00
FRME,First Merchants Corporation Common Stock,1996178291.00
HTH,Hilltop Holdings Inc.,1991730022.00
SBLK,Star Bulk Carriers Corp. Common Shares,1988679834.00
SNDX,Syndax Pharmaceuticals Inc. Common Stock,1978846169.00
BOWL,Bowlero Corp. Class A Common Stock,1976326572.00
DRH,Diamondrock Hospitality Company Common Stock,1972591924.00
BKE,Buckle Inc. (The) Common Stock,1971405685.00
AMBA,Ambarella Inc. Ordinary Shares,1970948135.00
TAC,TransAlta Corporation Ordinary Shares,1967644268.00
VECO,Veeco Instruments Inc. Common Stock,1957062171.00
UE,Urban Edge Properties Common Shares of Beneficial Interest,1951915600.00
IONQ,IonQ Inc. Common Stock,1949028298.00
PRFT,Perficient Inc. Common Stock,1947994324.00
FRA,Blackrock Floating Rate Income Strategies Fund Inc  Common Stock,1947300745.00
SCL,Stepan Company Common Stock,1946734955.00
SANA,Sana Biotechnology Inc. Common Stock,1944347453.00
CRTO,Criteo S.A. American Depositary Shares,1941781883.00
VRNT,Verint Systems Inc. Common Stock,1941781877.00
STAA,STAAR Surgical Company Common Stock,1932645356.00
ENLT,Enlight Renewable Energy Ltd. Ordinary Shares,1930636500.00
FOR,Forestar Group Inc Common Stock ,1928654665.00
OZKAP,Bank OZK 4.625% Series A Non-Cumulative Perpetual Preferred Stock,1923314244.00
AZZ,AZZ Inc.,1918380632.00
SEMR,SEMrush Holdings Inc. Class A Common Stock,1915505595.00
NAMS,NewAmsterdam Pharma Company N.V. Ordinary Shares,1910306802.00
KMT,Kennametal Inc. Common Stock,1909609048.00
ODP,The ODP Corporation Common Stock,1907232821.00
TWST,Twist Bioscience Corporation Common Stock,1903369284.00
MSGE,Madison Square Garden Entertainment Corp. Class A Common Stock,1902752114.00
ANDE,Andersons Inc. (The) Common Stock,1901712234.00
EPAC,Enerpac Tool Group Corp. Common Stock,1893991081.00
RKLB,Rocket Lab USA Inc. Common Stock,1892973391.00
UFPT,UFP Technologies Inc. Common Stock,1892053812.00
MLKN,MillerKnoll Inc. Common Stock,1891818343.00
NEO,NeoGenomics Inc. Common Stock,1889904678.00
OPEN,Opendoor Technologies Inc Common Stock,1889403982.00
DNN,Denison Mines Corp Ordinary Shares (Canada),1888912307.00
CAKE,Cheesecake Factory Incorporated (The) Common Stock,1887679203.00
SWI,SolarWinds Corporation Common Stock,1886719942.00
AFGC,American Financial Group Inc. 5.125% Subordinated Debentures due 2059,1883224664.00
NAVI,Navient Corporation Common Stock,1880668065.00
MSC,Studio City International Holdings Limited American depositary shares each representing four  Class A ordinary shares,1866944779.00
RXST,RxSight Inc. Common Stock,1864912574.00
DHT,DHT Holdings Inc.,1864374696.00
ACMR,ACM Research Inc. Class A Common Stock,1862176088.00
ATEC,Alphatec Holdings Inc. Common Stock,1861338410.00
BIGZ,BlackRock Innovation and Growth Term Trust Common Shares of Beneficial Interest,1860431813.00
VSTO,Vista Outdoor Inc. Common Stock,1859538917.00
EPC,Edgewell Personal Care Company Common Stock,1858510615.00
HRMY,Harmony Biosciences Holdings Inc. Common Stock,1856348949.00
SAH,Sonic Automotive Inc. Common Stock,1853745866.00
JANX,Janux Therapeutics Inc. Common Stock,1853046352.00
MHNC,Maiden Holdings North America Ltd. 7.75% Notes due 2043,1850696450.00
AG,First Majestic Silver Corp. Ordinary Shares (Canada),1849732368.00
NYMTL,New York Mortgage Trust Inc. 6.875% Series F Fixed-to-Floating Rate Cumulative Redeemable Preferred Stock $0.01 par value per share,1848412348.00
ECAT,BlackRock ESG Capital Allocation Term Trust Common Shares of Beneficial Interest,1848027150.00
TSLX,Sixth Street Specialty Lending Inc. Common Stock,1845297774.00
KAR,OPENLANE Inc. Common Stock,1844337692.00
GOTU,Gaotu Techedu Inc. American Depositary Shares,1844150964.00
MNR,Mach Natural Resources LP Common Units representing Limited Partner Interests,1843950000.00
GPCR,Structure Therapeutics Inc. American Depositary Shares,1841554580.00
NMRK,Newmark Group Inc. Class A Common Stock,1838935500.00
HTIA,Healthcare Trust Inc. 7.375% Series A Cumulative Redeemable Perpetual Preferred Stock,1835872914.00
SFL,SFL Corporation Ltd,1835185491.00
PNFPP,Pinnacle Financial Partners Inc. Depositary shares of Pinnacle Financial Partners Inc. each representing a 1/40th Interest in a share of its 6.75% Fixed-Rate Non-Cumulative Perpetual Preferred Stock Series B,1834247669.00
GRND,Grindr Inc. Common Stock,1832863238.00
SHLS,Shoals Technologies Group Inc. Class A Common Stock,1831042222.00
UP,Wheels Up Experience Inc. Class A Common Stock,1826982309.00
BPOPM,Popular Inc. Popular Capital Trust II - 6.125% Cumulative Monthly Income Trust Preferred Securities,1825136419.00
MGPI,MGP Ingredients Inc.,1824999955.00
PEB,Pebblebrook Hotel Trust Common Shares of Beneficial Interest,1824871266.00
BGR,BlackRock Energy and Resources Trust,1821871689.00
PHIN,PHINIA Inc. Common Stock,1820729300.00
UPBD,Upbound Group Inc. Common Stock,1820209480.00
MQY,Blackrock MuniYield Quality Fund Inc. Common Stock,1819365020.00
SUPN,Supernus Pharmaceuticals Inc. Common Stock,1815558491.00
SDGR,Schrodinger Inc. Common Stock,1813550149.00
SMTC,Semtech Corporation Common Stock,1812187384.00
BTSG,BrightSpring Health Services Inc. Common Stock,1809482412.00
HTIBP,Healthcare Trust Inc. 7.125% Series B Cumulative Redeemable Perpetual Preferred Stock,1805312760.00
RLJ,RLJ Lodging Trust Common Shares of Beneficial Interest $0.01 par value,1803980712.00
FUSN,Fusion Pharmaceuticals Inc. Common Shares,1803105135.00
WAFD,WaFd Inc. Common Stock,1800333634.00
PAYO,Payoneer Global Inc. Common Stock,1799505270.00
CPRX,Catalyst Pharmaceuticals Inc. Common Stock,1798593317.00
TDS,Telephone and Data Systems Inc. Common Shares,1797830000.00
HBI,Hanesbrands Inc. Common Stock,1797601761.00
MYGN,Myriad Genetics Inc. Common Stock,1797497720.00
MBIN,Merchants Bancorp Common Stock,1796082551.00
LOB,Live Oak Bancshares Inc. Common Stock,1793903407.00
NWLI,National Western Life Group Inc. Class A Common Stock,1790448968.00
B,Barnes Group Inc. Common Stock,1790093980.00
TLRY,Tilray Brands Inc. Common Stock ,1789967607.00
DAN,Dana Incorporated Common Stock ,1788948537.00
BCAT,BlackRock Capital Allocation Term Trust Common Shares of Beneficial Interest,1788552900.00
IAG,Iamgold Corporation Ordinary Shares,1786832000.00
SPNS,Sapiens International Corporation N.V. Common Shares (Cayman Islands),1785135485.00
AMRX,Amneal Pharmaceuticals Inc. Class A Common Stock,1783710135.00
CODI,D/B/A Compass Diversified Holdings Shares of Beneficial Interest,1780143281.00
TV,Grupo Televisa S.A.B. Common Stock,1779435000.00
TFIN,Triumph Financial Inc. Common Stock,1775848848.00
IBTX,Independent Bank Group Inc Common Stock,1772773147.00
PLAB,Photronics Inc. Common Stock,1770102769.00
DKL,Delek Logistics Partners L.P. Common Units representing Limited Partner Interests,1767353182.00
MHD,Blackrock MuniHoldings Fund Inc. Common Stock,1758372407.00
SJW,SJW Group Common Stock (DE),1757227948.00
