symbol,name,marketCap
MSFT,Microsoft Corporation Common Stock,3131483044350.00
AAPL,Apple Inc. Common Stock,2607207188040.00
NVDA,NVIDIA Corporation Common Stock,2236300000000.00
GOOG,Alphabet Inc. Class C Capital Stock,1937931710000.00
GOOGL,Alphabet Inc. Class A Common Stock,1921644480000.00
AMZN,Amazon.com Inc. Common Stock,1876895925471.00
META,Meta Platforms Inc. Class A Common Stock,1267997617571.00
BRK/A,Berkshire Hathaway Inc.,927075702586.00
BRK/B,Berkshire Hathaway Inc.,924267959539.00
TSM,Taiwan Semiconductor Manufacturing Company Ltd.,727191589620.00
LLY,Eli Lilly and Company Common Stock,725887634750.00
AVGO,Broadcom Inc. Common Stock,620409815246.00
JPM,JP Morgan Chase & Co. Common Stock,572790676092.00
NVO,Novo Nordisk A/S Common Stock,570334600000.00
TSLA,Tesla Inc. Common Stock,530681626851.00
V,Visa Inc.,511357761425.00
WMT,Walmart Inc. Common Stock,476714159554.00
XOM,Exxon Mobil Corporation Common Stock,473284468939.00
MA,Mastercard Incorporated Common Stock,447256171845.00
UNH,UnitedHealth Group Incorporated Common Stock (DE),422374892697.00
ASML,ASML Holding N.V. New York Registry Shares,380324711908.00
JNJ,Johnson & Johnson Common Stock,379934854872.00
PG,Procter & Gamble Company (The) Common Stock,377824590641.00
HD,Home Depot Inc. (The) Common Stock,359738725599.00
ORCL,Oracle Corporation Common Stock,341750230760.00
TM,Toyota Motor Corporation Common Stock,330527675643.00
MRK,Merck & Company Inc. Common Stock (new),330130128715.00
ABBV,AbbVie Inc. Common Stock,319184071238.00
COST,Costco Wholesale Corporation Common Stock,315464420807.00
CVX,Chevron Corporation Common Stock,296754466385.00
CRM,Salesforce Inc. Common Stock,294880000000.00
BAC,Bank of America Corporation Common Stock,293650126317.00
AMD,Advanced Micro Devices Inc. Common Stock,288741108487.00
NFLX,Netflix Inc. Common Stock,265805264089.00
KO,Coca-Cola Company (The) Common Stock,259394238505.00
PEP,PepsiCo Inc. Common Stock,235632154220.00
FMX,Fomento Economico Mexicano S.A.B. de C.V. Common Stock,229578597253.00
SHEL,Shell PLC American Depositary Shares (each representing two (2) Ordinary Shares) ,226242003922.00
DIS,Walt Disney Company (The) Common Stock,225289000503.00
SAP,SAP  SE ADS,224248046239.00
ADBE,Adobe Inc. Common Stock,223646080000.00
LIN,Linde plc Ordinary Shares,222170489592.00
CCZ,Comcast Holdings ZONES,221232453782.00
TMO,Thermo Fisher Scientific Inc Common Stock,217942839898.00
ACN,Accenture plc Class A Ordinary Shares (Ireland),211648042629.00
AZN,AstraZeneca PLC American Depositary Shares,207725371292.00
WFC,Wells Fargo & Company Common Stock,205166384094.00
MCD,McDonald's Corporation Common Stock,200542580277.00
CSCO,Cisco Systems Inc. Common Stock (DE),199867874269.00
ABT,Abbott Laboratories Common Stock,194375344054.00
NVS,Novartis AG Common Stock,192977248618.00
TMUS,T-Mobile US Inc. Common Stock,192367496556.00
QCOM,QUALCOMM Incorporated Common Stock,190880640000.00
TTE,TotalEnergies SE,187791713135.00
BABA,Alibaba Group Holding Limited American Depositary Shares each representing eight Ordinary share,186992021356.00
INTC,Intel Corporation Common Stock,185778320000.00
CAT,Caterpillar Inc. Common Stock,182187809049.00
DHR,Danaher Corporation Common Stock,181922242247.00
VZ,Verizon Communications Inc. Common Stock,178849749725.00
TBC,AT&T Inc. 5.625% Global Notes due 2067,175529521889.00
INTU,Intuit Inc. Common Stock,175432041610.00
IBM,International Business Machines Corporation Common Stock,173154766890.00
AMAT,Applied Materials Inc. Common Stock,171256254045.00
TBB,AT&T Inc. 5.350% Global Notes due 2066,167947562100.00
CMCSA,Comcast Corporation Class A Common Stock,166063355344.00
LYG,Lloyds Banking Group Plc American Depositary Shares,164008602208.00
AXP,American Express Company Common Stock,163254353062.00
PDD,PDD Holdings Inc. American Depositary Shares,162359028831.00
UBER,Uber Technologies Inc. Common Stock,159848769852.00
PFE,Pfizer Inc. Common Stock,155568745609.00
NOW,ServiceNow Inc. Common Stock,155185000000.00
TXN,Texas Instruments Incorporated Common Stock,154906247972.00
COP,ConocoPhillips Common Stock,153721281447.00
MS,Morgan Stanley Common Stock,151605723815.00
HSBC,HSBC Holdings plc. Common Stock,150000631583.00
BHP,BHP Group Limited American Depositary Shares (Each representing two Ordinary Shares),149872301149.00
GE,GE Aerospace Common Stock,148524982467.00
AMGN,Amgen Inc. Common Stock,148026159645.00
UNP,Union Pacific Corporation Common Stock,147889437482.00
HDB,HDFC Bank Limited Common Stock,143012817983.00
PM,Philip Morris International Inc Common Stock,142546564737.00
RY,Royal Bank Of Canada Common Stock,140837180376.00
LOW,Lowe's Companies Inc. Common Stock,139870438201.00
NKE,Nike Inc. Common Stock,137800352085.00
MU,Micron Technology Inc. Common Stock,135929435503.00
ISRG,Intuitive Surgical Inc. Common Stock,134715316977.00
SPGI,S&P Global Inc. Common Stock,133841151000.00
GS,Goldman Sachs Group Inc. (The) Common Stock,133529560682.00
SYK,Stryker Corporation Common Stock,132856648898.00
RTX,RTX Corporation Common Stock,130758790601.00
HON,Honeywell International Inc. Common Stock,130586364217.00
SCHW,Charles Schwab Corporation (The) Common Stock,130369410026.00
NEE,NextEra Energy Inc. Common Stock,129056745204.00
ARM,Arm Holdings plc American Depositary Shares,127769204125.00
UPS,United Parcel Service Inc. Common Stock,127173204048.00
LRCX,Lam Research Corporation Common Stock,126819864990.00
ETN,Eaton Corporation PLC Ordinary Shares,125742625000.00
T,AT&T Inc.,125316920273.00
UL,Unilever PLC Common Stock,123496398483.00
PGR,Progressive Corporation (The) Common Stock,123009837764.00
MUFG,Mitsubishi UFJ Financial Group Inc. Common Stock,122636846545.00
BKNG,Booking Holdings Inc. Common Stock,121856957674.00
BLK,BlackRock Inc. Common Stock,121624948726.00
SNY,Sanofi ADS,120661917043.00
C,Citigroup Inc. Common Stock,120110288644.00
ELV,Elevance Health Inc. Common Stock,116152885887.00
PLD,Prologis Inc. Common Stock,116146555980.00
BA,Boeing Company (The) Common Stock,114729823948.00
TJX,TJX Companies Inc. (The) Common Stock,113363652888.00
MDT,Medtronic plc. Ordinary Shares,113130480323.00
DE,Deere & Company Common Stock,112456716840.00
LMT,Lockheed Martin Corporation Common Stock,109522411105.00
BP,BP p.l.c. Common Stock,108147278750.00
BMY,Bristol-Myers Squibb Company Common Stock,106650480496.00
CI,The Cigna Group Common Stock,106151184938.00
RIO,Rio Tinto Plc Common Stock,105908480028.00
VRTX,Vertex Pharmaceuticals Incorporated Common Stock,105756386027.00
UBS,UBS Group AG Registered Ordinary Shares,105530000000.00
BUD,Anheuser-Busch Inbev SA Sponsored ADR (Belgium),105465245837.00
TD,Toronto Dominion Bank (The) Common Stock,105227298000.00
SONY,Sony Group Corporation American Depositary Shares ,104998368912.00
REGN,Regeneron Pharmaceuticals Inc. Common Stock,104787486873.00
CB,Chubb Limited  Common Stock,104012209767.00
ABNB,Airbnb Inc. Class A Common Stock,103601524154.00
PBR,Petroleo Brasileiro S.A.- Petrobras Common Stock,101940432863.00
ADP,Automatic Data Processing Inc. Common Stock,101736391823.00
SBUX,Starbucks Corporation Common Stock,101105460000.00
SHOP,Shopify Inc. Class A Subordinate Voting Shares,100326301206.00
MMC,Marsh & McLennan Companies Inc. Common Stock,99845540284.00
BSX,Boston Scientific Corporation Common Stock,98955600041.00
ADI,Analog Devices Inc. Common Stock,96642580272.00
KLAC,KLA Corporation Common Stock,93842687438.00
FI,Fiserv Inc. Common Stock,93443009373.00
MDLZ,Mondelez International Inc. Class A Common Stock,93257025486.00
CVS,CVS Health Corporation Common Stock,92898746002.00
ANET,Arista Networks Inc. Common Stock,90929486050.00
BX,Blackstone Inc. Common Stock,90266739848.00
IBN,ICICI Bank Limited Common Stock,89903752550.00
GILD,Gilead Sciences Inc. Common Stock,89807892067.00
AMT,American Tower Corporation (REIT) Common Stock,89623567333.00
PANW,Palo Alto Networks Inc. Common Stock,88335540000.00
HCA,HCA Healthcare Inc. Common Stock,87112646845.00
SNPS,Synopsys Inc. Common Stock,86922445436.00
KKR,KKR & Co. Inc. Common Stock,86642349380.00
GSK,GSK plc American Depositary Shares (Each representing two Ordinary Shares),86025413687.00
SHW,Sherwin-Williams Company (The) Common Stock,84980971767.00
WM,Waste Management Inc. Common Stock,84781370035.00
DELL,Dell Technologies Inc. Class C Common Stock ,84541327277.00
CNI,Canadian National Railway Company Common Stock,83878595159.00
CNQ,Canadian Natural Resources Limited Common Stock,83840857440.00
CDNS,Cadence Design Systems Inc. Common Stock,83403140040.00
SCCO,Southern Copper Corporation Common Stock,83318417000.00
DEO,Diageo plc Common Stock,83257628616.00
STLA,Stellantis N.V. Common Shares,83165454563.00
EQNR,Equinor ASA,81451318763.00
TGT,Target Corporation Common Stock,81368281905.00
CP,Canadian Pacific Kansas City Limited Common Shares,81085851000.00
RELX,RELX PLC PLC American Depositary Shares (Each representing One Ordinary Share),79896676073.00
GD,General Dynamics Corporation Common Stock,79602207889.00
CMG,Chipotle Mexican Grill Inc. Common Stock,79574587168.00
ITW,Illinois Tool Works Inc. Common Stock,78862284000.00
ICE,Intercontinental Exchange Inc. Common Stock,78734758438.00
SLB,Schlumberger N.V. Common Stock,78342337262.00
SMFG,Sumitomo Mitsui Financial Group Inc Unsponsored American Depositary Shares (Japan),78063767394.00
SO,Southern Company (The) Common Stock,77833018161.00
CME,CME Group Inc. Class A Common Stock,77326925141.00
CRWD,CrowdStrike Holdings Inc. Class A Common Stock,77289129664.00
EOG,EOG Resources Inc. Common Stock,76699447553.00
MELI,MercadoLibre Inc. Common Stock,76680387999.00
MPC,Marathon Petroleum Corporation Common Stock,76384008770.00
SAN,Banco Santander S.A. Sponsored ADR (Spain),76279288717.00
ENB,Enbridge Inc Common Stock,76202270863.00
MO,Altria Group Inc.,75705414001.00
RACE,Ferrari N.V. Common Shares,75701626383.00
ZTS,Zoetis Inc. Class A Common Stock,75552652646.00
EQIX,Equinix Inc. Common Stock REIT,75003583979.00
DUK,Duke Energy Corporation (Holding Company) Common Stock,74414136997.00
INFY,Infosys Limited American Depositary Shares,73954465309.00
CL,Colgate-Palmolive Company Common Stock,73309820846.00
PSX,Phillips 66 Common Stock,72511962471.00
TRI,Thomson Reuters Corp Common Shares,72256796677.00
WDAY,Workday Inc. Class A Common Stock,71718240000.00
MAR,Marriott International Class A Common Stock,71717097636.00
CSX,CSX Corporation Common Stock,71527994826.00
MCO,Moody's Corporation Common Stock,71394000000.00
PH,Parker-Hannifin Corporation Common Stock,70297237914.00
MCK,McKesson Corporation Common Stock,70076096675.00
NOC,Northrop Grumman Corporation Common Stock,69970651384.00
BMO,Bank Of Montreal Common Stock,69954028069.00
BDX,Becton Dickinson and Company Common Stock,69631215957.00
FCX,Freeport-McMoRan Inc. Common Stock,69396707904.00
PYPL,PayPal Holdings Inc. Common Stock,69298828926.00
BBVA,Banco Bilbao Vizcaya Argentaria S.A. Common Stock,68946075888.00
CTAS,Cintas Corporation Common Stock,68500733487.00
APH,Amphenol Corporation Common Stock,67819589680.00
BTI,British American Tobacco  Industries p.l.c. Common Stock ADR,67808235207.00
FDX,FedEx Corporation Common Stock,67743569668.00
TT,Trane Technologies plc,67556257362.00
USB,U.S. Bancorp Common Stock,67358108222.00
ORLY,O'Reilly Automotive Inc. Common Stock,67314104583.00
TDG,Transdigm Group Incorporated Common Stock,66939929117.00
BN,Brookfield Corporation Class A Limited Voting Shares,66386288751.00
HMC,Honda Motor Company Ltd. Common Stock,65827309146.00
AON,Aon plc Class A Ordinary Shares (Ireland),65366865365.00
ECL,Ecolab Inc. Common Stock,64939967105.00
ITUB,Itau Unibanco Banco Holding SA American Depositary Shares (Each repstg 500 Preferred shares),64903376004.00
EMR,Emerson Electric Company Common Stock,64756459000.00
EPD,Enterprise Products Partners L.P. Common Stock,64505295831.00
MRVL,Marvell Technology Inc. Common Stock,63728940000.00
PCAR,PACCAR Inc. Common Stock,63704255123.00
PXD,Pioneer Natural Resources Company Common Stock,62949749953.00
PNC,PNC Financial Services Group Inc. (The) Common Stock,62670689964.00
APO,Apollo Global Management Inc. (New) Common Stock,62666419956.00
NTES,NetEase Inc. American Depositary Shares,62441589035.00
NXPI,NXP Semiconductors N.V. Common Stock,61747696030.00
BNS,Bank Nova Scotia Halifax Pfd 3 Ordinary Shares,60532254781.00
CEG,Constellation Energy Corporation Common Stock ,59574475794.00
COIN,Coinbase Global Inc. Class A Common Stock,59560929022.00
RSG,Republic Services Inc. Common Stock,59436230585.00
MNST,Monster Beverage Corporation,59212201772.00
OXY,Occidental Petroleum Corporation Common Stock,59155132267.00
AMX,America Movil S.A.B. de C.V. American Depositary Shares (each representing the right to receive twenty (20) Series B Shares,59082225000.00
VLO,Valero Energy Corporation Common Stock,58922443736.00
VALE,VALE S.A.  American Depositary Shares Each Representing one common share,58636971257.00
MSI,Motorola Solutions Inc. Common Stock,58490438621.00
ROP,Roper Technologies Inc. Common Stock,58427772478.00
CRH,CRH PLC Ordinary Shares,58136441130.00
ING,ING Group N.V. Common Stock,57720208739.00
EW,Edwards Lifesciences Corporation Common Stock,56708603000.00
NSC,Norfolk Southern Corporation Common Stock,56642046946.00
SMCI,Super Micro Computer Inc. Common Stock,56487629300.00
PFH,Prudential Financial Inc. 4.125% Junior Subordinated Notes due 2060,55896471347.00
DASH,DoorDash Inc. Class A Common Stock,55550579013.00
CPRT,Copart Inc. (DE) Common Stock,55043689768.00
COF,Capital One Financial Corporation Common Stock,54906446690.00
E,ENI S.p.A. Common Stock,54875566753.00
AZO,AutoZone Inc. Common Stock,54850881946.00
EL,Estee Lauder Companies Inc. (The) Common Stock,54763982693.00
APD,Air Products and Chemicals Inc. Common Stock,53316684072.00
ADSK,Autodesk Inc. Common Stock,53202880481.00
AJG,Arthur J. Gallagher & Co. Common Stock,53194048000.00
F,Ford Motor Company Common Stock,53147028757.00
SPOT,Spotify Technology S.A. Ordinary Shares,53145914807.00
ET,Energy Transfer LP Common Units ,53143214234.00
AIG,American International Group Inc. New Common Stock,53128003929.00
HLT,Hilton Worldwide Holdings Inc. Common Stock ,53047008172.00
MET,MetLife Inc. Common Stock,52946777521.00
DXCM,DexCom Inc. Common Stock,52680682280.00
FTNT,Fortinet Inc. Common Stock,52534680770.00
TRV,The Travelers Companies Inc. Common Stock,52206323555.00
SNOW,Snowflake Inc. Class A Common Stock,52198698000.00
GM,General Motors Company Common Stock,51822510253.00
WELL,Welltower Inc. Common Stock,51756525808.00
DHI,D.R. Horton Inc. Common Stock,51647359943.00
MMM,3M Company Common Stock,51312668000.00
CARR,Carrier Global Corporation Common Stock ,51027077870.00
TEAM,Atlassian Corporation Class A Common Stock,50848920544.00
TFC,Truist Financial Corporation Common Stock,50565337267.00
PLTR,Palantir Technologies Inc. Class A Common Stock,50273293578.00
NGG,National Grid Transco PLC National Grid PLC (NEW) American Depositary Shares,50174159139.00
PSA,Public Storage Common Stock,49787430066.00
SU,Suncor Energy  Inc. Common Stock,49277390060.00
GWW,W.W. Grainger Inc. Common Stock,49197943679.00
AFL,AFLAC Incorporated Common Stock,49005317297.00
SPG,Simon Property Group Inc. Common Stock,48897887460.00
STZ,Constellation Brands Inc. Common Stock,48887914651.00
SQ,Block Inc. Class A Common Stock,48769042530.00
MFG,Mizuho Financial Group Inc. Sponosred ADR (Japan),48613519597.00
COR,Cencora Inc. Common Stock,48492077678.00
ROST,Ross Stores Inc. Common Stock,48372209099.00
PCG,Pacific Gas & Electric Co. Common Stock,47996125218.00
WMB,Williams Companies Inc. (The) Common Stock,47818281760.00
HES,Hess Corporation Common Stock,47765217473.00
NUE,Nucor Corporation Common Stock,47756592990.00
MCHP,Microchip Technology Incorporated Common Stock,47543331753.00
ODFL,Old Dominion Freight Line Inc. Common Stock,47141721418.00
OKE,ONEOK Inc. Common Stock,46652755680.00
URI,United Rentals Inc. Common Stock,46482495642.00
CM,Canadian Imperial Bank of Commerce Common Stock,46394590478.00
LULU,lululemon athletica inc. Common Stock,45704479424.00
LEN,Lennar Corporation Class A Common Stock,45624913134.00
O,Realty Income Corporation Common Stock,45527613033.00
ALL,Allstate Corporation (The) Common Stock,45389651784.00
SRE,DBA Sempra Common Stock,45388363969.00
KHC,The Kraft Heinz Company Common Stock,45357801036.00
AEP,American Electric Power Company Inc. Common Stock,44836188488.00
CCI,Crown Castle Inc. Common Stock,44659040417.00
JCI,Johnson Controls International plc Ordinary Share,44636746513.00
IQV,IQVIA Holdings Inc. Common Stock,44560065000.00
MFC,Manulife Financial Corporation Common Stock,44141524409.00
TEL,TE Connectivity Ltd. New Switzerland Registered Shares,44062527455.00
FERG,Ferguson plc Ordinary Shares,43988198543.00
PAYX,Paychex Inc. Common Stock,43927048518.00
JD,JD.com Inc. American Depositary Shares,43703650328.00
FAST,Fastenal Company Common Stock,43661359207.00
DLR,Digital Realty Trust Inc. Common Stock,43658640107.00
WCN,Waste Connections Inc. Common Shares,43640121742.00
AMP,Ameriprise Financial Inc. Common Stock,43445893985.00
IDXX,IDEXX Laboratories Inc. Common Stock,43345237386.00
BK,The Bank of New York Mellon Corporation Common Stock,43040653157.00
KMB,Kimberly-Clark Corporation Common Stock,43016615553.00
KDP,Keurig Dr Pepper Inc. Common Stock,42904314029.00
MSCI,MSCI Inc. Common Stock,42890373355.00
NU,Nu Holdings Ltd. Class A Ordinary Shares,42696000000.00
TTD,The Trade Desk Inc. Class A Common Stock,42581508612.00
TAK,Takeda Pharmaceutical Company Limited American Depositary Shares (each representing 1/2 of a share of Common Stock),42516874312.00
FIS,Fidelity National Information Services Inc. Common Stock,42485524743.00
NEM,Newmont Corporation,42402373622.00
MPLX,MPLX LP Common Units Representing Limited Partner Interests,42369267288.00
A,Agilent Technologies Inc. Common Stock,42249780294.00
CMI,Cummins Inc. Common Stock,41971185322.00
PRU,Prudential Financial Inc. Common Stock,41751700000.00
AME,AMETEK Inc.,41667757993.00
DOW,Dow Inc. Common Stock ,41638977643.00
KR,Kroger Company (The) Common Stock,41597063706.00
TRP,TC Energy Corporation Common Stock,41469630000.00
DDOG,Datadog Inc. Class A Common Stock,41281820170.00
HSY,The Hershey Company Common Stock,40902163676.00
KMI,Kinder Morgan Inc. Common Stock,40880794847.00
ALC,Alcon Inc. Ordinary Shares,40825490000.00
D,Dominion Energy Inc. Common Stock,40800235481.00
ARES,Ares Management Corporation Class A Common Stock,40495750240.00
CHTR,Charter Communications Inc. Class A Common Stock New,40375582111.00
GEHC,GE HealthCare Technologies Inc. Common Stock ,40121525447.00
CTVA,Corteva Inc. Common Stock ,40120934110.00
SYY,Sysco Corporation Common Stock,40040446632.00
LVS,Las Vegas Sands Corp. Common Stock,39874109755.00
KVUE,Kenvue Inc. Common Stock,39861594138.00
GIS,General Mills Inc. Common Stock,39834560717.00
OTIS,Otis Worldwide Corporation Common Stock ,39633189692.00
YUM,Yum! Brands Inc.,39586827959.00
MRNA,Moderna Inc. Common Stock,39586605081.00
LHX,L3Harris Technologies Inc. Common Stock,39010132051.00
CNC,Centene Corporation Common Stock,38750824350.00
DKNG,DraftKings Inc. Class A Common Stock,38747182846.00
CVE,Cenovus Energy Inc Common Stock,38242917000.00
GEV,GE Vernova Inc.,38091700640.00
BIDU,Baidu Inc. ADS,38055927830.00
CSGP,CoStar Group Inc. Common Stock,38051496438.00
IMO,Imperial Oil Limited Common Stock,38028337909.00
ABEV,Ambev S.A. American Depositary Shares (Each representing 1 Common Share),37966738214.00
STM,STMicroelectronics N.V. Common Stock,37871246848.00
HLN,Haleon plc American Depositary Shares (Each representing two Ordinary Shares),37807726571.00
WDS,Woodside Energy Group Limited American Depositary Shares each representing one Ordinary Share,37766132945.00
EXC,Exelon Corporation Common Stock,37562658408.00
IR,Ingersoll Rand Inc. Common Stock,37338000412.00
PWR,Quanta Services Inc. Common Stock,37326312754.00
LNG,Cheniere Energy Inc. Common Stock,37222194656.00
MLM,Martin Marietta Materials Inc. Common Stock,37222069727.00
HUM,Humana Inc. Common Stock,36718423354.00
IT,Gartner Inc. Common Stock,36604362180.00
FANG,Diamondback Energy Inc. Common Stock,35755341836.00
BCS,Barclays PLC Common Stock,35688974670.00
CTSH,Cognizant Technology Solutions Corporation Class A Common Stock,35685316854.00
HAL,Halliburton Company Common Stock,35523954896.00
EA,Electronic Arts Inc. Common Stock,35330363421.00
NDAQ,Nasdaq Inc. Common Stock,35277418938.00
RCL,Royal Caribbean Cruises Ltd. Common Stock,35276562705.00
VMC,Vulcan Materials Company (Holding Company) Common Stock,35205468038.00
VEEV,Veeva Systems Inc. Class A Common Stock,34910524757.00
ACGL,Arch Capital Group Ltd. Common Stock,34231094660.00
DG,Dollar General Corporation Common Stock,34024890135.00
FLUT,Flutter Entertainment plc Ordinary Shares,34003055024.00
LYB,LyondellBasell Industries NV Ordinary Shares Class A (Netherlands),33808820725.00
CDW,CDW Corporation Common Stock,33772550394.00
BKR,Baker Hughes Company Class A Common Stock,33619606428.00
PPG,PPG Industries Inc. Common Stock,33326175844.00
VRSK,Verisk Analytics Inc. Common Stock,33265019189.00
PEG,Public Service Enterprise Group Incorporated Common Stock,33116121706.00
GPN,Global Payments Inc. Common Stock,33114952803.00
DVN,Devon Energy Corporation Common Stock,32778700000.00
HBANM,Huntington Bancshares Incorporated Depositary Shares each representing a 1/1000th interest in a share of Huntington Series I Preferred Stock,32717408872.00
CPNG,Coupang Inc. Class A Common Stock,32692181981.00
RYAAY,Ryanair Holdings plc American Depositary Shares,32530751580.00
ROK,Rockwell Automation Inc. Common Stock,32112122325.00
DD,DuPont de Nemours Inc. Common Stock,32082891441.00
NET,Cloudflare Inc. Class A Common Stock,32067498498.00
DFS,Discover Financial Services Common Stock,32023472126.00
LI,Li Auto Inc. American Depositary Shares,32016383252.00
DB,Deutsche Bank AG Common Stock,32007600000.00
ADM,Archer-Daniels-Midland Company Common Stock,31967541893.00
EFX,Equifax Inc. Common Stock,31695649179.00
CCEP,Coca-Cola Europacific Partners plc Ordinary Shares,31685959936.00
TCOM,Trip.com Group Limited American Depositary Shares,31599128655.00
MPWR,Monolithic Power Systems Inc. Common Stock,31579529170.00
ED,Consolidated Edison Inc. Common Stock,31303208809.00
SLF,Sun Life Financial Inc. Common Stock,31190083643.00
ORAN,Orange,31107860550.00
FICO,Fair Isaac Corproation Common Stock,30997722176.00
XYL,Xylem Inc. Common Stock New,30975625314.00
HUBS,HubSpot Inc. Common Stock,30909920495.00
VRT,Vertiv Holdings LLC Class A Common Stock,30851754781.00
SE,Sea Limited American Depositary Shares each representing one Class A Ordinary Share,30835832773.00
WIT,Wipro Limited Common Stock,30787218527.00
EXR,Extra Space Storage Inc Common Stock,30781981570.00
VICI,VICI Properties Inc. Common Stock,30727765602.00
CHT,Chunghwa Telecom Co. Ltd.,30696215998.00
AEM,Agnico Eagle Mines Limited Common Stock,30335591094.00
HIG,Hartford Financial Services Group Inc. (The) Common Stock,30288077112.00
BIIB,Biogen Inc. Common Stock,30182716097.00
DAL,Delta Air Lines Inc. Common Stock,30171888612.00
GOLD,Barrick Gold Corporation Common Stock (BC),30160684938.00
ON,ON Semiconductor Corporation Common Stock,30118123393.00
ANSS,ANSYS Inc. Common Stock,30089017304.00
BCE,BCE Inc. Common Stock,30050323512.00
XEL,Xcel Energy Inc. Common Stock,30022824042.00
BBD,Banco Bradesco Sa American Depositary Shares,30010920043.00
FTV,Fortive Corporation Common Stock ,29804029123.00
NWG,NatWest Group plc American Depositary Shares (each representing two (2) Ordinary Shares),29803388454.00
DLTR,Dollar Tree Inc. Common Stock,29368852015.00
BNH,Brookfield Finance Inc. 4.625% Subordinated Notes due October 16 2080,29268486720.00
HPQ,HP Inc. Common Stock,28990436708.00
CBRE,CBRE Group Inc Common Stock Class A,28842405806.00
WST,West Pharmaceutical Services Inc. Common Stock,28432796918.00
MTD,Mettler-Toledo International Inc. Common Stock,28374443240.00
ZS,Zscaler Inc. Common Stock,28284194390.00
GFS,GlobalFoundries Inc. Ordinary Shares,27996013600.00
HBANP,Huntington Bancshares Incorporated Depositary Shares 4.500% Series H Non-Cumulative Perpetual Preferred Stock,27982042073.00
GRMN,Garmin Ltd. Common Stock (Switzerland),27949640754.00
GLW,Corning Incorporated Common Stock,27746450046.00
TSCO,Tractor Supply Company Common Stock,27722677392.00
WTW,Willis Towers Watson Public Limited Company Ordinary Shares,27445557660.00
ECCF,Eagle Point Credit Company Inc. 8.00% Series F Term Preferred Stock due 2029,27162387059.00
RMD,ResMed Inc. Common Stock,27117307392.00
CAH,Cardinal Health Inc. Common Stock,27059688271.00
NTR,Nutrien Ltd. Common Shares,27003149628.00
EIX,Edison International Common Stock,26966687476.00
RJF,Raymond James Financial Inc. Common Stock,26903944198.00
EBAY,eBay Inc. Common Stock,26863480000.00
KEYS,Keysight Technologies Inc. Common Stock,26837960708.00
BNJ,Brookfield Finance Inc. 4.50% Perpetual Subordinated Notes,26795324160.00
MSTR,MicroStrategy Incorporated Common Stock Class A,26789784794.00
HWM,Howmet Aerospace Inc. Common Stock,26776416264.00
BBDO,Banco Bradesco Sa American Depositary Shares (each representing one Common Share),26765058123.00
ICLR,ICON plc Ordinary Shares,26618689400.00
TROW,T. Rowe Price Group Inc. Common Stock,26514489337.00
OWL,Blue Owl Capital Inc. Class A Common Stock,26447161059.00
MBLY,Mobileye Global Inc. Class A Common Stock,26371829323.00
