symbol,name,marketCap
CWCO,Consolidated Water Co. Ltd. Ordinary Shares,414175321.00
VLGEA,Village Super Market Inc. Class A Common Stock,414081437.00
RERE,ATRenew Inc. American Depositary Shares (every three of which representing two Class A ordinary shares),414074748.00
SKE,Skeena Resources Limited Common Shares,413731254.00
STTK,Shattuck Labs Inc. Common Stock,413505360.00
ALRS,Alerus Financial Corporation Common Stock,413310139.00
ADTN,ADTRAN Holdings Inc. Common Stock,412984434.00
TSAT,Telesat Corporation Class A Common Shares and Class B Variable Voting Shares ,412658111.00
MEI,Methode Electronics Inc. Common Stock,412653230.00
CCNE,CNB Financial Corporation Common Stock,411035075.00
ALTG,Alta Equipment Group Inc. Class A Common Stock,410395041.00
CATX,Perspective Therapeutics Inc. Common Stock,409633698.00
HCAT,Health Catalyst Inc Common Stock,407598515.00
MNMD,Mind Medicine (MindMed) Inc. Common Shares,407142924.00
AMRN,Amarin Corporation plc,406565082.00
TRC,Tejon Ranch Co Common Stock,406359897.00
OUST,Ouster Inc. Common Stock,405702131.00
WTI,W&T Offshore Inc. Common Stock,405326085.00
RENB,Renovaro Inc. Common Stock,405144809.00
GBLI,Global Indemnity Group LLC Class A Common Stock (DE),404720009.00
OCS,Oculis Holding AG Ordinary shares,403513252.00
CDMO,Avid Bioservices Inc. Common Stock,403466338.00
KRNY,Kearny Financial Corp Common Stock,403375589.00
SENEA,Seneca Foods Corp. Class A Common Stock,403206488.00
FFWM,First Foundation Inc. Common Stock,403178828.00
OPY,Oppenheimer Holdings Inc. Class A Common Stock (DE),403014360.00
ETO,Eaton Vance Tax-Advantage Global Dividend Opp Common Stock,402656551.00
GUT,Gabelli Utility Trust (The) Common Stock,402226679.00
CORZZ,Core Scientific Inc. Tranche 2 Warrants,401367127.00
SENEB,Seneca Foods Corp. Class B Common Stock,400359488.00
AMSC,American Superconductor Corporation Common Stock,400187238.00
LFMD,LifeMD Inc. Common Stock,399623865.00
EVN,Eaton Vance Municipal Income Trust Common Stock,399448331.00
ZYXI,Zynex Inc. Common Stock,399231959.00
BVS,Bioventus Inc. Class A Common Stock,398994322.00
MCFT,MasterCraft Boat Holdings Inc. Common Stock,398761375.00
SHYF,The Shyft Group Inc. Common Stock,398045323.00
RVNC,Revance Therapeutics Inc. Common Stock,397845384.00
ETB,Eaton Vance Tax-Managed Buy-Write Income Fund Eaton Vance Tax-Managed Buy-Write Income Fund Common Shares of Beneficial Interest,397688729.00
DCGO,DocGo Inc. Common Stock,396892916.00
AROW,Arrow Financial Corporation Common Stock,396611270.00
FARO,FARO Technologies Inc. Common Stock,395889249.00
NL,NL Industries Inc. Common Stock,395551220.00
OIS,Oil States International Inc. Common Stock,395480295.00
BHRB,Burke & Herbert Financial Services Corp. Common Stock,395437329.00
EEX,Emerald Holding Inc. Common Stock,395202752.00
IREN,Iris Energy Limited Ordinary Shares,395162285.00
FORR,Forrester Research Inc. Common Stock,395055780.00
CVEO,Civeo Corporation (Canada) Common Shares,394910128.00
JSPR,Jasper Therapeutics Inc. Common Stock,394674075.00
REI,Ring Energy Inc. Common Stock,393889062.00
NGVC,Natural Grocers by Vitamin Cottage Inc. Common Stock,393844269.00
MPX,Marine Products Corporation Common Stock,393304642.00
WLDN,Willdan Group Inc. Common Stock,393274227.00
CRBP,Corbus Pharmaceuticals Holdings Inc. Common Stock,393071826.00
CRMT,America's Car-Mart Inc Common Stock,392986185.00
PRCH,Porch Group Inc. Common Stock,391361925.00
RCEL,Avita Medical Inc. Common Stock,391255396.00
GENK,GEN Restaurant Group Inc. Class A Common Stock,390784608.00
LXEO,Lexeo Therapeutics Inc. Common Stock,389366758.00
ACRE,Ares Commercial Real Estate Corporation Common Stock,389121683.00
ESGRP,Enstar Group Limited Depositary Shares Each Representing 1/1000th of an interest in Preference Shares,388960047.00
MCB,Metropolitan Bank Holding Corp. Common Stock,388823429.00
NATR,Nature's Sunshine Products Inc. Common Stock,388425419.00
CSV,Carriage Services Inc. Common Stock,387317907.00
EFT,Eaton Vance Floating Rate Income Trust Common Shares of Beneficial Interest,387193424.00
KODK,Eastman Kodak Company Common New,386716000.00
AUDC,AudioCodes Ltd. Common Stock,386520561.00
CHSCP,CHS Inc. 8%  Cumulative Redeemable Preferred Stock,385105272.00
FSBC,Five Star Bancorp Common Stock,384897724.00
MGX,Metagenomi Inc. Common Stock,384466321.00
BHB,Bar Harbor Bankshares Inc. Common Stock,384181031.00
SRDX,Surmodics Inc. Common Stock,383944920.00
CIX,CompX International Inc. Common Stock,383819806.00
ANIK,Anika Therapeutics Inc. Common Stock,383574002.00
HRTX,Heron Therapeutics Inc. Common Stock,383337892.00
MED,MEDIFAST INC Common Stock,382653296.00
LOTWW,Lotus Technology Inc. Warrants,382396374.00
CTO,CTO Realty Growth Inc. Common Stock,382272002.00
SMMF,Summit Financial Group Inc. Common Stock,381776954.00
SOHON,Sotherly Hotels Inc. 8.25% Series D Cumulative Redeemable Perpetual Preferred Stock,381302460.00
BOOM,DMC Global Inc. Common Stock,381081981.00
SOHOB,Sotherly Hotels Inc. 8.0% Series B Cumulative Redeemable Perpetual Preferred Stock,380111510.00
ANRO,Alto Neuroscience Inc. Common Stock,379333071.00
KTF,DWS Municipal Income Trust,378418986.00
ASLE,AerSale Corporation Common Stock,377974185.00
SDHY,PGIM Short Duration High Yield Opportunities Fund Common Shares,377867853.00
NEXN,Nexxen International Ltd. American Depository Shares,377828796.00
TBI,TrueBlue Inc. Common Stock,377593249.00
ESGRO,Enstar Group Limited Depository Shares 7.00% Perpetual Non-Cumulative Preference Shares Series E,377107236.00
LE,Lands' End Inc. Common Stock,376719642.00
VALU,Value Line Inc. Common Stock,376433821.00
LGVC,LAMF Global Ventures Corp. I Class A Ordinary Shares,376264796.00
UIS,Unisys Corporation New Common Stock,376257624.00
MYPS,PLAYSTUDIOS Inc.  Class A Common Stock,375935637.00
REAL,The RealReal Inc. Common Stock,375845755.00
LEO,BNY Mellon Strategic Municipals Inc. Common Stock,375613850.00
SMHI,SEACOR Marine Holdings Inc. Common Stock ,375061216.00
HRZN,Horizon Technology Finance Corporation Common Stock,374723597.00
ESQ,Esquire Financial Holdings Inc. Common Stock,374603133.00
SOHOO,Sotherly Hotels Inc. 7.875% Series C Cumulative Redeemable Perpetual Preferred Stock,373164302.00
VKI,Invesco Advantage Municipal Income Trust II Common Shares of Beneficial Interest (DE),373010568.00
AVXL,Anavex Life Sciences Corp. Common Stock,372790800.00
SOI,Solaris Oilfield Infrastructure Inc. Class A Common Stock,372475676.00
BLZE,Backblaze Inc. Class A Common Stock,371864000.00
TYG,Tortoise Energy Infrastructure Corporation Common Stock,371315620.00
SGU,Star Group L.P. Common Stock,370685602.00
HIFS,Hingham Institution for Savings Common Stock,369739332.00
AUROW,Aurora Innovation Inc. Warrant,369232287.00
SEZL,Sezzle Inc. Common Stock,368747439.00
ARTNA,Artesian Resources Corporation Class A Common Stock,367701626.00
GHI,Greystone Housing Impact Investors LP Beneficial Unit Certificates representing assignments of limited partnership interests,366353312.00
AURA,Aura Biosciences Inc. Common Stock,366332597.00
AMSWA,American Software Inc. Class A Common Stock,365089218.00
CLOV,Clover Health Investments Corp. Class A Common Stock,365030544.00
CIFRW,Cipher Mining Inc. Warrant,364686923.00
AVD,American Vanguard Corporation Common Stock ($0.10 Par Value),364555567.00
GBAB,Guggenheim Taxable Municipal Bond & Investment Grade Debt Trust Common Shares of Beneficial Interest,363501768.00
ALLG,Allego N.V. Ordinary Share,363364800.00
FF,FutureFuel Corp.  Common shares,362797284.00
FFIC,Flushing Financial Corporation Common Stock,362765046.00
EPIX,ESSA Pharma Inc. Common Stock,362752805.00
SHBI,Shore Bancshares Inc Common Stock,362658900.00
NPCE,Neuropace Inc. Common Stock,362527907.00
SNDA,Sonida Senior Living Inc. Common Stock,361794094.00
JFIN,Jiayin Group Inc. American Depositary Shares,361199313.00
HNST,The Honest Company Inc. Common Stock,360557665.00
RXT,Rackspace Technology Inc. Common Stock,360398940.00
TNYA,Tenaya Therapeutics Inc. Common Stock,360389092.00
CVRX,CVRx Inc. Common Stock,359956939.00
SOHU,Sohu.com Limited American Depositary Shares,359900169.00
MOBBW,Mobilicom Limited Warrants,358202707.00
MCI,Barings Corporate Investors Common Stock,357821958.00
TCMD,Tactile Systems Technology Inc. Common Stock,357784853.00
EAF,GrafTech International Ltd. Common Stock,356996299.00
THRD,Third Harmonic Bio Inc. Common Stock,355843847.00
ADCT,ADC Therapeutics SA Common Shares,355702356.00
MGTX,MeiraGTx Holdings plc Ordinary Shares,355120928.00
SOR,Source Capital Inc. Common Stock,355057752.00
PSNYW,Polestar Automotive Holding UK PLC Class C-1 ADS (ADW),354259262.00
MOFG,MidWestOne Financial Gp Common Stock,354228093.00
OCGN,Ocugen Inc. Common Stock,353973359.00
FBLG,FibroBiologics Inc. Common Stock,352451153.00
ANL,Adlai Nortye Ltd. American Depositary Shares,352397559.00
MTRX,Matrix Service Company Common Stock,350319737.00
NLOP,Net Lease Office Properties Common Shares of Beneficial Interest,348780934.00
LMNR,Limoneira Co Common Stock,348575212.00
PPT,Putnam Premier Income Trust Common Stock,348348921.00
TPVG,TriplePoint Venture Growth BDC Corp. Common Stock,347609807.00
SMBK,SmartFinancial Inc. Common Stock,347473782.00
YSG,Yatsen Holding Limited American Depositary Shares each representing twenty (20) Class A Ordinary Shares,346586828.00
CTV,Innovid Corp. Common Stock,346048979.00
PGEN,Precigen Inc. Common Stock,345997543.00
ENTA,Enanta Pharmaceuticals Inc. Common Stock,345900322.00
SLDP,Solid Power Inc. Class A Common Stock,345885388.00
ADAP,Adaptimmune Therapeutics plc American Depositary Shares,345555106.00
SAZ,Saratoga Investment Corp 8.50% Notes due 2028,345432943.00
NWPX,Northwest Pipe Company Common Stock,345338238.00
AGS,PlayAGS Inc. Common Stock,344765415.00
TCRX,TScan Therapeutics Inc. Common Stock,344751811.00
SAY,Saratoga Investment Corp 8.125% Notes due 2027,344750269.00
ORGO,Organogenesis Holdings Inc. Class A Common Stock,344423889.00
GCI,Gannett Co. Inc. Common Stock,343761158.00
CYD,China Yuchai International Limited Common Stock,343618219.00
AEHR,Aehr Test Systems Common Stock,343017428.00
GAMB,Gambling.com Group Limited Ordinary Shares,342819676.00
SAJ,Saratoga Investment Corp 8.00% Notes due 2027,342702248.00
RFMZ,RiverNorth Flexible Municipal Income Fund II Inc. Common Stock,342629207.00
VMD,Viemed Healthcare Inc. Common Shares,342608662.00
ATLCP,Atlanticus Holdings Corporation 7.625% Series B Cumulative Perpetual Preferred Stock no par value per share,342100045.00
PTSI,P.A.M. Transportation Services Inc. Common Stock,341538811.00
LOVE,The Lovesac Company Common Stock,341532428.00
GLUE,Monte Rosa Therapeutics Inc. Common Stock,341047696.00
PMO,Putnam Municipal Opportunities Trust Common Stock,340835117.00
HBB,Hamilton Beach Brands Holding Company Class A Common Stock ,339924422.00
NAUT,Nautilus Biotechnolgy Inc. Common Stock,339015797.00
JRVR,James River Group Holdings Ltd. Common Shares,338564146.00
HQL,abrdn Life Sciences Investors Shares of Beneficial Interest,338457602.00
BETR,Better Home & Finance Holding Company Class A Common Stock,338330440.00
PROK,ProKidney Corp. Class A Ordinary Shares,338281708.00
PKOH,Park-Ohio Holdings Corp. Common Stock,338098631.00
AXGN,Axogen Inc. Common Stock,337440781.00
GAU,Galiano Gold Inc.,337434179.00
ATLCL,Atlanticus Holdings Corporation 6.125% Senior Notes due 2026,337131484.00
GNTY,Guaranty Bancshares Inc. Common Stock,335198120.00
LYRA,Lyra Therapeutics Inc. Common Stock,335158920.00
RRBI,Red River Bancshares Inc. Common Stock,333912452.00
FCNCO,First Citizens BancShares Inc. 5.625% Non-Cumulative Perpetual Preferred Stock Series C,332613684.00
NYXH,Nyxoah SA Ordinary Shares,332456000.00
GHM,Graham Corporation Common Stock,332321356.00
RDIB,Reading International Inc Class B Common Stock,331874018.00
PBPB,Potbelly Corporation Common Stock,331844316.00
AKBA,Akebia Therapeutics Inc. Common Stock,330808195.00
CHSCO,CHS Inc. Class B Cumulative Redeemable Preferred Stock,330730481.00
SAT,Saratoga Investment Corp 6.00% Notes due 2027,330414119.00
HRTG,Heritage Insurance Holdings Inc. Common Stock,330292992.00
DOMO,Domo Inc. Class B Common Stock,330291636.00
MVIS,MicroVision Inc. Common Stock,330001881.00
MCBC,Macatawa Bank Corporation Common Stock,329870995.00
MPB,Mid Penn Bancorp Common Stock,328870866.00
UHG,United Homes Group Inc Class A Common Stock,328439124.00
LUNG,Pulmonx Corporation Common Stock,327952900.00
OPT,Opthea Limited American Depositary Shares,327260901.00
JILL,J. Jill Inc. Common Stock,327199476.00
FCNCP,First Citizens BancShares Inc. Depositary Shares,326803838.00
HSHP,Himalaya Shipping Ltd. Common Shares,326616000.00
ARDC,Ares Dynamic Credit Allocation Fund Inc. Common Shares,326308731.00
GILT,Gilat Satellite Networks Ltd. Ordinary Shares,326132012.00
AVIR,Atea Pharmaceuticals Inc. Common Stock,325716789.00
ERAS,Erasca Inc. Common Stock,325712446.00
FNKO,Funko Inc. Class A Common Stock,325315447.00
AIRS,AirSculpt Technologies Inc. Common Stock,324435690.00
SOPH,SOPHiA GENETICS SA Ordinary Shares,323543573.00
MBI,MBIA Inc. Common Stock,322870276.00
HYLN,Hyliion Holdings Corp. Class A Common Stock,322446740.00
LINC,Lincoln Educational Services Corporation Common Stock,322357118.00
GPRO,GoPro Inc. Class A Common Stock,322278374.00
HIVE,HIVE Digital Technologies Ltd. Common Shares,321676464.00
NEGG,Newegg Commerce Inc. Common Shares,321096000.00
SPOK,Spok Holdings Inc. Common Stock,319767477.00
EGHT,8x8 Inc Common Stock,319661470.00
PKE,Park Aerospace Corp. Common Stock,319598037.00
CERS,Cerus Corporation Common Stock,319057596.00
CLMB,Climb Global Solutions Inc. Common Stock,318587868.00
TCI,Transcontinental Realty Investors Inc. Common Stock,318531581.00
RBB,RBB Bancorp Common Stock,318246237.00
CDRO,Codere Online Luxembourg S.A. Ordinary Shares,318006000.00
RMMZ,RiverNorth Managed Duration Municipal Income Fund II Inc. Common Stock,318005407.00
STRO,Sutro Biopharma Inc. Common Stock,317829592.00
GHG,GreenTree Hospitality Group Ltd. American depositary shares each representing one Class A ordinary share,317776550.00
POWW,AMMO Inc. Common Stock,316824827.00
ISPR,Ispire Technology Inc. Common Stock,316448879.00
SLQT,SelectQuote Inc. Common Stock,316019700.00
SCM,Stellus Capital Investment Corporation Common Stock,315804654.00
PXSAP,Pyxis Tankers Inc. 7.75% Series A Cumulative Convertible Preferred Shares,314713237.00
WBX,Wallbox N.V. Class A Ordinary Shares,314710509.00
CHSCL,CHS Inc Class B Cumulative Redeemable Preferred Stock Series 4,314285997.00
CHSCN,CHS Inc Preferred Class B Series 2 Reset Rate,314285997.00
SWKHL,SWK Holdings Corporation 9.00% Senior Notes due 2027,314273548.00
PSTL,Postal Realty Trust Inc. Class A Common Stock,314040001.00
PROC,Procaps Group S.A. Ordinary Shares,313651229.00
SAR,Saratoga Investment Corp New,313210739.00
PYXS,Pyxis Oncology Inc. Common Stock,312757558.00
BWB,Bridgewater Bancshares Inc. Common Stock,312566758.00
HEAR,Turtle Beach Corporation Common Stock,312496631.00
WLFC,Willis Lease Finance Corporation Common Stock,312377762.00
LEV,The Lion Electric Company Common Shares,312177960.00
PANL,Pangaea Logistics Solutions Ltd. Common Shares,312097803.00
GCO,Genesco Inc. Common Stock,311813272.00
FINS,Angel Oak Financial Strategies Income Term Trust Common Shares of Beneficial Interest,311779217.00
CRESW,Cresud S.A.C.I.F. y A. Warrant,311757233.00
TGAN,Transphorm Inc. Common Stock,310636944.00
VTYX,Ventyx Biosciences Inc. Common Stock,310482309.00
ATAI,ATAI Life Sciences N.V. Common Shares,310439590.00
TPTA,Terra Property Trust Inc. 6.00% Notes due 2026,309557532.00
SNBR,Sleep Number Corporation Common Stock,308899710.00
HUMA,Humacyte Inc. Common Stock,307618510.00
CHSCM,CHS Inc Class B Reset Rate Cumulative Redeemable Preferred Stock Series 3,307536395.00
TRUE,TrueCar Inc. Common Stock,307242047.00
DDL,Dingdong (Cayman) Limited American Depositary Shares (each two representing three Ordinary Shares),306830191.00
TTSH,Tile Shop Holdings Inc. Common Stock,306679267.00
XOMA,XOMA Corporation Common Stock,306340515.00
OIA,Invesco Municipal Income Opportunities Trust Common Stock,306103937.00
STEM,Stem Inc. Class A Common Stock,306080823.00
MODV,ModivCare Inc. Common Stock,305685976.00
NODK,NI Holdings Inc. Common Stock,305313837.00
MTLS,Materialise NV American Depositary Shares,304786680.00
IVCP,Swiftmerge Acquisition Corp. Class A Ordinary Share,303750000.00
SMTI,Sanara MedTech Inc. Common Stock,303608964.00
AQST,Aquestive Therapeutics Inc. Common Stock,303466972.00
MIN,MFS Intermediate Income Trust Common Stock,303330115.00
EBTC,Enterprise Bancorp Inc Common Stock,303282630.00
BRT,BRT Apartments Corp. (MD) Common Stock,302896820.00
GWRS,Global Water Resources Inc. Common Stock,302674017.00
BYRN,Byrna Technologies Inc. Common Stock,300767709.00
ASA,ASA  Gold and Precious Metals Limited,300343821.00
TRAK,ReposiTrak Inc. Common Stock,300274671.00
HBCP,Home Bancorp Inc. Common Stock,299894534.00
TMTCU,TMT Acquisition Corp Unit,299750000.00
ACNB,ACNB Corporation Common Stock,299386947.00
NVX,NOVONIX Limited American Depository Shares,299349244.00
SERA,Sera Prognostics Inc. Class A Common Stock,298640338.00
SFIX,Stitch Fix Inc. Class A Common Stock,298025437.00
CPZ,Calamos Long/Short Equity & Dynamic Income Trust Common Stock,298016705.00
FHTX,Foghorn Therapeutics Inc. Common Stock,297961328.00
ORN,Orion Group Holdings Inc. Common,297495849.00
SMLP,Summit Midstream Partners LP Common Units Representing Limited Partner Interests,296534267.00
ITIC,Investors Title Company Common Stock,296260624.00
ADTH,AdTheorent Holding Company Inc. Common Stock,295439001.00
MG,Mistras Group Inc Common Stock,295319327.00
FSTR,L.B. Foster Company Common Stock,294733936.00
RYAM,Rayonier Advanced Materials Inc. Common Stock,294291252.00
COOK,Traeger Inc. Common Stock,294263746.00
AMBI,Ambipar Emergency Response Class A Ordinary Shares,293778205.00
NCV,Virtus Convertible & Income Fund Common Shares of Beneficial Interest,293714099.00
XERS,Xeris Biopharma Holdings Inc. Common Stock,293547746.00
MTA,Metalla Royalty & Streaming Ltd. Common Shares,293422409.00
VZLA,Vizsla Silver Corp. Common Shares,293271285.00
TLS,Telos Corporation Common Stock,293232815.00
IPX,IperionX Limited American Depositary Share,293143365.00
LX,LexinFintech Holdings Ltd. American Depositary Shares,292908400.00
FENC,Fennec Pharmaceuticals Inc. Common Stock,292696670.00
PCTTW,PureCycle Technologies Inc. Warrant,292515438.00
RMM,RiverNorth Managed Duration Municipal Income Fund Inc. Common Stock,291949098.00
VSTM,Verastem Inc. Common Stock,291404102.00
MYTE,MYT Netherlands Parent B.V. American Depositary Shares each representing one Ordinary Share,291173376.00
XOMAO,XOMA Corporation Depositary Shares Rep Series B 8.375% Cumulative Preferred Stock,291110683.00
MEC,Mayville Engineering Company Inc. Common Stock,291014521.00
UROY,Uranium Royalty Corp. Common Stock,290857949.00
INO,Inovio Pharmaceuticals Inc. Common Stock,290026230.00
PMM,Putnam Managed Municipal Income Trust Common Stock,289995914.00
EVI,EVI Industries Inc.  Common Stock,289987137.00
CCSI,Consensus Cloud Solutions Inc. Common Stock,289692515.00
IHRT,iHeartMedia Inc. Class A Common Stock,289493290.00
LOCO,El Pollo Loco Holdings Inc. Common Stock,289366085.00
PPTA,Perpetua Resources Corp. Common Shares,288555552.00
FBIZ,First Business Financial Services Inc. Common Stock,288320108.00
WOW,WideOpenWest Inc. Common Stock,287692078.00
ONTF,ON24 Inc. Common Stock,287550986.00
CBNK,Capital Bancorp Inc. Common Stock,287108721.00
AEON,AEON Biopharma Inc. Class A Common Stock,286872112.00
ZUMZ,Zumiez Inc. Common Stock,286788043.00
XOMAP,XOMA Corporation 8.625% Series A Cumulative Perpetual Preferred Stock,286692869.00
BRLT,Brilliant Earth Group Inc. Class A Common Stock,286406449.00
FMAO,Farmers & Merchants Bancorp Inc. Common Stock,286268028.00
RAPT,RAPT Therapeutics Inc. Common Stock,285689133.00
WEYS,Weyco Group Inc. Common Stock,285506171.00
WTBA,West Bancorporation Common Stock,284493849.00
REFI,Chicago Atlantic Real Estate Finance Inc. Common Stock,284240139.00
SGC,Superior Group of Companies Inc. Common Stock,283895951.00
BLNK,Blink Charging Co. Common Stock,283791957.00
INBK,First Internet Bancorp Common Stock,283479219.00
FRST,Primis Financial Corp. Common Stock,283346651.00
NGS,Natural Gas Services Group Inc. Common Stock,283197139.00
RMNI,Rimini Street Inc. (DE) Common Stock,283134600.00
SPIR,Spire Global Inc. Class A Common Stock,282956077.00
ARL,American Realty Investors Inc. Common Stock,281853150.00
CARE,Carter Bankshares Inc. Common Stock,281791985.00
BSRR,Sierra Bancorp Common Stock,281417943.00
WHF,WhiteHorse Finance Inc. Common Stock,281241365.00
RDW,Redwire Corporation Common Stock,280676939.00
OCCIO,OFS Credit Company Inc. 6.125% Series C Term Preferred Stock,280422551.00
DM,Desktop Metal Inc. Class A Common Stock,280388818.00
PSTX,Poseida Therapeutics Inc. Common Stock,279818468.00
GROY,Gold Royalty Corp. Common Shares,279792650.00
EDAP,EDAP TMS S.A. American Depositary Shares,279415702.00
NEWT,NewtekOne Inc. Common Stock,278524445.00
SSP,E.W. Scripps Company (The) Class A Common Stock,278197566.00
NATH,Nathan's Famous Inc. Common Stock,278162282.00
ADVM,Adverum Biotechnologies Inc. Common Stock,278115861.00
FISI,Financial Institutions Inc. Common Stock,277354440.00
OPFI,OppFi Inc. Class A Common Stock,277294543.00
MCR,MFS Charter Income Trust Common Stock,277252794.00
MVBF,MVB Financial Corp. Common Stock,276388856.00
AFRI,Forafric Global PLC Ordinary Shares,276326400.00
PFIS,Peoples Financial Services Corp. Common Stock,275926498.00
IPI,Intrepid Potash Inc Common Stock,275436094.00
ORRF,Orrstown Financial Services Inc Common Stock,275334580.00
AMPY,Amplify Energy Corp. Common Stock,274712996.00
QUAD,Quad Graphics Inc Class A Common Stock,273958377.00
UNTY,Unity Bancorp Inc. Common Stock,273909679.00
MMT,MFS Multimarket Income Trust Common Stock,273624461.00
NRGV,Energy Vault Holdings Inc. Common Stock,273567615.00
GBIO,Generation Bio Co. Common Stock,273220926.00
API,Agora Inc. American Depositary Shares,273013338.00
ACB,Aurora Cannabis Inc. Common Shares,272969577.00
LWAY,Lifeway Foods Inc. Common Stock,272517809.00
LXFR,Luxfer Holdings PLC Ordinary Shares,272371474.00
NEWP,New Pacific Metals Corp. Common Shares,272219742.00
CZNC,Citizens & Northern Corp Common Stock,270653944.00
SENS,Senseonics Holdings Inc. Common Stock,270640902.00
CDXC,ChromaDex Corporation Common Stock,270359734.00
CPS,Cooper-Standard Holdings Inc. Common Stock,269656471.00
SGHT,Sight Sciences Inc. Common Stock,269570338.00
VBNK,VersaBank Common Shares,269251077.00
RDVT,Red Violet Inc. Common Stock ,269086820.00
AIP,Arteris Inc. Common Stock,268732764.00
VNET,VNET Group Inc. American Depositary Shares,268698737.00
BCAL,Southern California Bancorp Common Stock,268545629.00
HMST,HomeStreet Inc. Common Stock,268154589.00
ACIU,AC Immune SA Common Stock,267834138.00
CCG,Cheche Group Inc. Class A Ordinary Shares,267281299.00
FATBP,FAT Brands Inc. 8.25% Series B Cumulative Preferred Stock,266868746.00
FDBC,Fidelity D & D Bancorp Inc. Common Stock,266234124.00
CHRS,Coherus BioSciences Inc. Common Stock,266006192.00
OCCIN,OFS Credit Company Inc. 5.25% Series E Term Preferred Stock Due 2026,264159437.00
LCTX,Lineage Cell Therapeutics Inc. Common Stock,263946950.00
CRNT,Ceragon Networks Ltd. Ordinary Shares,263942612.00
BTBT,Bit Digital Inc. Ordinary Shares,263937894.00
FSBW,FS Bancorp Inc. Common Stock,262899176.00
AOMR,Angel Oak Mortgage REIT Inc. Common Stock,262884335.00
OBT,Orange County Bancorp Inc. Common Stock,262746297.00
FNLC,First Bancorp Inc  (ME) Common Stock,262337565.00
NRIM,Northrim BanCorp Inc Common Stock,261999896.00
COMM,CommScope Holding Company Inc. Common Stock,261092808.00
BMRC,Bank of Marin Bancorp Common Stock,259741206.00
GOSS,Gossamer Bio Inc. Common Stock,259419588.00
HOWL,Werewolf Therapeutics Inc. Common Stock,258987377.00
ILPT,Industrial Logistics Properties Trust Common Shares of Beneficial Interest,258101969.00
XBIT,XBiotech Inc. Common Stock,257918962.00
TLSI,TriSalus Life Sciences Inc. Common Stock,257903474.00
RNGR,Ranger Energy Services Inc. Class A Common Stock,257673410.00
SCLX,Scilex Holding Company Common Stock,257594244.00
EOT,Eaton Vance Municipal Income Trust EATON VANCE NATIONAL MUNICIPAL OPPORTUNITIES TRUST,257186200.00
ESEA,Euroseas Ltd. Common Stock (Marshall Islands),256986600.00
SBT,Sterling Bancorp Inc. Common Stock,255654926.00
ME,23andMe Holding Co. Class A Common Stock,255462900.00
QSI,Quantum-Si Incorporated Class A Common Stock,255185851.00
BSVN,Bank7 Corp. Common stock,255066868.00
PBYI,Puma Biotechnology Inc Common Stock,254533815.00
WRN,Western Copper and Gold Corporation Common Stock,254498688.00
GTE,Gran Tierra Energy Inc. Common Stock,253779963.00
PRLD,Prelude Therapeutics Incorporated Common Stock,253733144.00
NNAVW,NextNav Inc. Warrant,253513161.00
TSVT,2seventy bio Inc. Common Stock ,253476992.00
IBEX,IBEX Limited Common Shares,253214292.00
TCBX,Third Coast Bancshares Inc. Common Stock,252820048.00
ACV,Virtus Diversified Income & Convertible Fund Common Shares of Beneficial Interest,252234300.00
XFLT,XAI Octagon Floating Rate & Alternative Income Trust Common Shares of Beneficial Interest,251826577.00
FTF,Franklin Limited Duration Income Trust Common Shares of Beneficial Interest,251725480.00
VLN,Valens Semiconductor Ltd. Ordinary Shares,251027157.00
VRCA,Verrica Pharmaceuticals Inc. Common Stock,249845277.00
CDT,Conduit Pharmaceuticals Inc. Common Stock,249751252.00
CLAR,Clarus Corporation Common Stock,249682830.00
